text,label,clean_text,url_count,dot_count,has_at_symbol,urgency_flag,threat_flag,suspicious_domain_flag,caps_word_count,digit_count,special_char_count
உங்கள் Airtel கணக்கில் அசாதாரண செயல்பாடு. சரிபார்க்க: https://verify-secure.in,1,உங்கள் airtel கணக்கில் அசாதாரண செயல்பாடு. சரிபார்க்க: https:/verify-secure.in,1.0,2.0,0.0,1.0,0.0,0.0,0.0,0.0,0.0
Kolkata ಗೆ ಯಾವಾಗ ಬರುತ್ತೀರಿ? 2420,0,kolkata ಗೆ ಯಾವಾಗ ಬರುತ್ತೀರಿ? 2420,0.0,0.0,0.0,0.0,0.0,0.0,0.0,4.0,1.0
ଆପଣଙ୍କ XpressBees ପାର୍ସଲ୍ ଅଟକି ରହିଛି। ଶୁଳ୍କ ଦିଅନ୍ତୁ: http://tinyurl.com/secure-login,1,ଆପଣଙ୍କ xpressbees ପାର୍ସଲ୍ ଅଟକି ରହିଛି। ଶୁଳ୍କ ଦିଅନ୍ତୁ: http:/tinyurl.com/secure-login,1.0,1.0,0.0,0.0,0.0,1.0,0.0,0.0,0.0
అభినందనలు! మీరు 50000 రూపాయలు గెలుచుకున్నారు. ఇప్పుడే క్లెయిం చేయండి,1,అభినందనలు! మీరు 50000 రూపాయలు గెలుచుకున్నారు. ఇప్పుడే క్లెయిం చేయండి,0.0,1.0,0.0,0.0,0.0,0.0,0.0,5.0,1.0
ਕੀ ਅਸੀਂ ਅੱਜ ਮਿਲ ਰਹੇ ਹਾਂ? 1173,0,ਕੀ ਅਸੀਂ ਅੱਜ ਮਿਲ ਰਹੇ ਹਾਂ? 1173,0.0,0.0,0.0,0.0,0.0,0.0,0.0,4.0,1.0
అభినందనలు! మీరు 10000 BDT గెలుచుకున్నారు. క్లెయిమ్ చేయండి: http://claim-prize.top,1,అభినందనలు! మీరు 10000 bdt గెలుచుకున్నారు. క్లెయిమ్ చేయండి: http:/claim-prize.top,1.0,2.0,0.0,0.0,0.0,0.0,1.0,5.0,1.0
अति आवश्यक: आपका KYC अधूरा है। अभी अपडेट करें: https://verify-secure.in,1,अति आवश्यक: आपका kyc अधूरा है। अभी अपडेट करें: https:/verify-secure.in,1.0,1.0,0.0,1.0,0.0,0.0,1.0,0.0,0.0
वाढदिवसाच्या हार्दिक शुभेच्छा! 6395,0,वाढदिवसाच्या हार्दिक शुभेच्छा! 6395,0.0,0.0,0.0,0.0,0.0,0.0,0.0,4.0,1.0
તમારા Flipkart ખાતામાં શંકાસ્પદ લોગિન. તપાસો: https://verify-secure.in,1,તમારા flipkart ખાતામાં શંકાસ્પદ લોગિન. તપાસો: https:/verify-secure.in,1.0,2.0,0.0,1.0,0.0,0.0,0.0,0.0,0.0
అభినందనలు! మీరు 5000 ₹ గెలుచుకున్నారు. క్లెయిమ్ చేయండి: https://verify-secure.in,1,అభినందనలు! మీరు 5000 ₹ గెలుచుకున్నారు. క్లెయిమ్ చేయండి: https:/verify-secure.in,1.0,2.0,0.0,1.0,0.0,0.0,0.0,4.0,1.0
அவசரம்: உங்கள் KYC-ஐ உடனே புதுப்பிக்கவும்: http://claim-prize.top 7185,1,அவசரம்: உங்கள் kyc-ஐ உடனே புதுப்பிக்கவும்: http:/claim-prize.top 7185,1.0,1.0,0.0,1.0,0.0,0.0,1.0,4.0,0.0
कृपया फाईल पाठवा. 4012,0,कृपया फाईल पाठवा. 4012,0.0,1.0,0.0,0.0,0.0,0.0,0.0,4.0,0.0
ਕੀ ਅਸੀਂ ਅੱਜ ਮਿਲ ਰਹੇ ਹਾਂ? 1321,0,ਕੀ ਅਸੀਂ ਅੱਜ ਮਿਲ ਰਹੇ ਹਾਂ? 1321,0.0,0.0,0.0,0.0,0.0,0.0,0.0,4.0,1.0
Chennai ಗೆ ಯಾವಾಗ ಬರುತ್ತೀರಿ? 8090,0,chennai ಗೆ ಯಾವಾಗ ಬರುತ್ತೀರಿ? 8090,0.0,0.0,0.0,0.0,0.0,0.0,0.0,4.0,1.0
ବସ ଟିକେଟ ବୁକ କରିଛି,0,ବସ ଟିକେଟ ବୁକ କରିଛି,0.0,0.0,0.0,0.0,0.0,0.0,0.0,0.0,0.0
অভিনন্দন! আপুনি 25000 INR জিকিছে। ইয়াত পাওক: http://goo.gl/verify-account,1,অভিনন্দন! আপুনি 25000 inr জিকিছে। ইয়াত পাওক: http:/goo.gl/verify-account,1.0,1.0,0.0,1.0,0.0,1.0,1.0,5.0,1.0
ನಿಮ್ಮ Prime Video ಖಾತೆಯಲ್ಲಿ ಅಸಹಜ ಚಟುವಟಿಕೆ. ಪರಿಶೀಲಿಸಿ: https://verify-secure.in 5650,1,ನಿಮ್ಮ prime video ಖಾತೆಯಲ್ಲಿ ಅಸಹಜ ಚಟುವಟಿಕೆ. ಪರಿಶೀಲಿಸಿ: https:/verify-secure.in 5650,1.0,2.0,0.0,1.0,0.0,0.0,0.0,4.0,0.0
வாழ்த்துக்கள்! நீங்கள் 5000 Rs வென்றுள்ளீர்கள். பெற: http://goo.gl/verify-account,1,வாழ்த்துக்கள்! நீங்கள் 5000 rs வென்றுள்ளீர்கள். பெற: http:/goo.gl/verify-account,1.0,2.0,0.0,1.0,0.0,1.0,0.0,4.0,1.0
आपके खाते में संदिग्ध गतिविधि। पासवर्ड रीसेट करें,1,आपके खाते में संदिग्ध गतिविधि। पासवर्ड रीसेट करें,0.0,0.0,0.0,0.0,0.0,0.0,0.0,0.0,0.0
Jaipur کا سفر کیسا رہا؟ 3623,0,jaipur کا سفر کیسا رہا؟ 3623,0.0,0.0,0.0,0.0,0.0,0.0,0.0,4.0,0.0
ਜਨਮਦਿਨ ਮੁਬਾਰਕ! 3900,0,ਜਨਮਦਿਨ ਮੁਬਾਰਕ! 3900,0.0,0.0,0.0,0.0,0.0,0.0,0.0,4.0,1.0
ದಯವಿಟ್ಟು ಫೈಲ್ ಕಳುಹಿಸಿ. 3669,0,ದಯವಿಟ್ಟು ಫೈಲ್ ಕಳುಹಿಸಿ. 3669,0.0,1.0,0.0,0.0,0.0,0.0,0.0,4.0,0.0
तुमचे Axis Bank खाते ब्लॉक केले आहे. येथे क्लिक करा: http://claim-prize.top 9017,1,तुमचे axis bank खाते ब्लॉक केले आहे. येथे क्लिक करा: http:/claim-prize.top 9017,1.0,2.0,0.0,0.0,0.0,0.0,0.0,4.0,0.0
শুভ জন্মদিন!,0,শুভ জন্মদিন!,0.0,0.0,0.0,0.0,0.0,0.0,0.0,0.0,1.0
Kolkata का मौसम कैसा है? 1506,0,kolkata का मौसम कैसा है? 1506,0.0,0.0,0.0,0.0,0.0,0.0,0.0,4.0,1.0
ಅಭಿನಂದನೆಗಳು! ನೀವು 10000 ₹ ಗೆದ್ದಿದ್ದೀರಿ. ಪಡೆಯಲು: https://bank-kyc.net,1,ಅಭಿನಂದನೆಗಳು! ನೀವು 10000 ₹ ಗೆದ್ದಿದ್ದೀರಿ. ಪಡೆಯಲು: https:/bank-kyc.net,1.0,2.0,0.0,0.0,0.0,0.0,0.0,5.0,1.0
আপোনাৰ Zomato একাউণ্টত অস্বাভাৱিক কাৰ্যকলাপ। চাওক: https://bank-kyc.net,1,আপোনাৰ zomato একাউণ্টত অস্বাভাৱিক কাৰ্যকলাপ। চাওক: https:/bank-kyc.net,1.0,1.0,0.0,0.0,0.0,0.0,0.0,0.0,0.0
आपका DHL पार्सल रुका हुआ है। शुल्क भरें: https://verify-secure.in,1,आपका dhl पार्सल रुका हुआ है। शुल्क भरें: https:/verify-secure.in,1.0,1.0,0.0,1.0,0.0,0.0,1.0,0.0,0.0
ನಿಮ್ಮ Amazon ಪಾರ್ಸೆಲ್ ಬಾಕಿಯಿದೆ. ಹಣ ಪಾವತಿಸಿ: http://tinyurl.com/secure-login,1,ನಿಮ್ಮ amazon ಪಾರ್ಸೆಲ್ ಬಾಕಿಯಿದೆ. ಹಣ ಪಾವತಿಸಿ: http:/tinyurl.com/secure-login,1.0,2.0,0.0,0.0,0.0,1.0,0.0,0.0,0.0
आपका ICICI खाता ब्लॉक कर दिया गया है। यहाँ सत्यापित करें: http://claim-prize.top 9011,1,आपका icici खाता ब्लॉक कर दिया गया है। यहाँ सत्यापित करें: http:/claim-prize.top 9011,1.0,1.0,0.0,1.0,0.0,0.0,1.0,4.0,0.0
অনুগ্ৰহ কৰি ফাইলটো পঠাওক। 1613,0,অনুগ্ৰহ কৰি ফাইলটো পঠাওক। 1613,0.0,0.0,0.0,0.0,0.0,0.0,0.0,4.0,0.0
Happy birthday! Have a great one. 3046,0,happy birthday! have a great one. 3046,0.0,1.0,0.0,0.0,0.0,0.0,0.0,4.0,1.0
దయచేసి ఫైల్ పంపండి. 7138,0,దయచేసి ఫైల్ పంపండి. 7138,0.0,1.0,0.0,0.0,0.0,0.0,0.0,4.0,0.0
अभिनंदन! तुम्ही 25000 BDT जिंकले आहेत. मिळवा: http://goo.gl/verify-account,1,अभिनंदन! तुम्ही 25000 bdt जिंकले आहेत. मिळवा: http:/goo.gl/verify-account,1.0,2.0,0.0,1.0,0.0,1.0,1.0,5.0,1.0
அவசரம்: உங்கள் KYC-ஐ உடனே புதுப்பிக்கவும்: https://verify-secure.in 8483,1,அவசரம்: உங்கள் kyc-ஐ உடனே புதுப்பிக்கவும்: https:/verify-secure.in 8483,1.0,1.0,0.0,1.0,0.0,0.0,1.0,4.0,0.0
Jaipur کا سفر کیسا رہا؟,0,jaipur کا سفر کیسا رہا؟,0.0,0.0,0.0,0.0,0.0,0.0,0.0,0.0,0.0
आपण आज भेटणार आहोत का? 8168,0,आपण आज भेटणार आहोत का? 8168,0.0,0.0,0.0,0.0,0.0,0.0,0.0,4.0,1.0
آج رات ریستوراں میں ملتے ہیں,0,آج رات ریستوراں میں ملتے ہیں,0.0,0.0,0.0,0.0,0.0,0.0,0.0,0.0,0.0
तातडीचे: तुमचे KYC अपडेट करा: http://tinyurl.com/secure-login 3143,1,तातडीचे: तुमचे kyc अपडेट करा: http:/tinyurl.com/secure-login 3143,1.0,1.0,0.0,0.0,0.0,1.0,1.0,4.0,0.0
તમારું XpressBees પાર્સલ અટકી ગયું છે. ચુકવણી કરો: http://bit.ly/update-now,1,તમારું xpressbees પાર્સલ અટકી ગયું છે. ચુકવણી કરો: http:/bit.ly/update-now,1.0,2.0,0.0,0.0,0.0,1.0,0.0,0.0,0.0
আপোনাৰ Swiggy একাউণ্টত অস্বাভাৱিক কাৰ্যকলাপ। চাওক: https://verify-secure.in,1,আপোনাৰ swiggy একাউণ্টত অস্বাভাৱিক কাৰ্যকলাপ। চাওক: https:/verify-secure.in,1.0,1.0,0.0,1.0,0.0,0.0,0.0,0.0,0.0
Reached Mumbai safely.,0,reached mumbai safely.,0.0,1.0,0.0,0.0,0.0,0.0,0.0,0.0,0.0
ସୁରକ୍ଷା ସତର୍କତା: ଅସାଧାରଣ କାର୍ଯ୍ୟକଳାପ। ତୁରନ୍ତ ଯାଞ୍ଚ କରନ୍ତୁ,1,ସୁରକ୍ଷା ସତର୍କତା: ଅସାଧାରଣ କାର୍ଯ୍ୟକଳାପ। ତୁରନ୍ତ ଯାଞ୍ଚ କରନ୍ତୁ,0.0,0.0,0.0,0.0,0.0,0.0,0.0,0.0,0.0
কাল অফিস বন্ধ থাকবে,0,কাল অফিস বন্ধ থাকবে,0.0,0.0,0.0,0.0,0.0,0.0,0.0,0.0,0.0
জন্মদিনৰ শুভকামনা জনালোঁ! 7736,0,জন্মদিনৰ শুভকামনা জনালোঁ! 7736,0.0,0.0,0.0,0.0,0.0,0.0,0.0,4.0,1.0
ഞാൻ വീട്ടിലെത്തി. 4134,0,ഞാൻ വീട്ടിലെത്തി. 4134,0.0,1.0,0.0,0.0,0.0,0.0,0.0,4.0,0.0
మీ PNB ఖాతా నిలిపివేయబడింది. ధృవీకరించండి: http://goo.gl/verify-account 7024,1,మీ pnb ఖాతా నిలిపివేయబడింది. ధృవీకరించండి: http:/goo.gl/verify-account 7024,1.0,2.0,0.0,1.0,0.0,1.0,1.0,4.0,0.0
మనం సాయంత్రం కలుద్దామా? 9932,0,మనం సాయంత్రం కలుద్దామా? 9932,0.0,0.0,0.0,0.0,0.0,0.0,0.0,4.0,1.0
সেই ফাইলবোৰ পঠিয়াব পাৰিবনে?,0,সেই ফাইলবোৰ পঠিয়াব পাৰিবনে?,0.0,0.0,0.0,0.0,0.0,0.0,0.0,0.0,1.0
હું ઘરે પહોંચી ગયો છું. 5108,0,હું ઘરે પહોંચી ગયો છું. 5108,0.0,1.0,0.0,0.0,0.0,0.0,0.0,4.0,0.0
શું આપણે આજે મળીશું? 7448,0,શું આપણે આજે મળીશું? 7448,0.0,0.0,0.0,0.0,0.0,0.0,0.0,4.0,1.0
ತುರ್ತು: ನಿಮ್ಮ KYC ನವೀಕರಿಸಿ: http://goo.gl/verify-account 8286,1,ತುರ್ತು: ನಿಮ್ಮ kyc ನವೀಕರಿಸಿ: http:/goo.gl/verify-account 8286,1.0,1.0,0.0,1.0,0.0,1.0,1.0,4.0,0.0
ਜਰੂਰੀ: ਆਪਣਾ KYC ਅਪਡੇਟ ਕਰੋ: http://claim-prize.top 1896,1,ਜਰੂਰੀ: ਆਪਣਾ kyc ਅਪਡੇਟ ਕਰੋ: http:/claim-prize.top 1896,1.0,1.0,0.0,0.0,0.0,0.0,1.0,4.0,0.0
ਕਿਰਪਾ ਕਰਕੇ ਫਾਈਲ ਭੇਜੋ। 5099,0,ਕਿਰਪਾ ਕਰਕੇ ਫਾਈਲ ਭੇਜੋ। 5099,0.0,0.0,0.0,0.0,0.0,0.0,0.0,4.0,0.0
Unusual login in your Netflix account. Check: http://goo.gl/verify-account 5447,1,unusual login in your netflix account. check: http:/goo.gl/verify-account 5447,1.0,2.0,0.0,1.0,0.0,1.0,0.0,4.0,0.0
فوری: اپنا KYC اپ ڈیٹ کریں: https://short.url/pay-bill,1,فوری: اپنا kyc اپ ڈیٹ کریں: https:/short.url/pay-bill,1.0,1.0,0.0,0.0,0.0,0.0,1.0,0.0,0.0
مبارک ہو! آپ نے 100000 Rs جیتے ہیں۔ کلیم کریں: http://bit.ly/update-now,1,مبارک ہو! آپ نے 100000 rs جیتے ہیں۔ کلیم کریں: http:/bit.ly/update-now,1.0,1.0,0.0,0.0,0.0,1.0,0.0,6.0,1.0
سالگرہ مبارک! 9912,0,سالگرہ مبارک! 9912,0.0,0.0,0.0,0.0,0.0,0.0,0.0,4.0,1.0
ਕੀ ਤੁਸੀਂ ਉਹ ਫਾਇਲਾਂ ਭੇਜ ਸਕਦੇ ਹੋ?,0,ਕੀ ਤੁਸੀਂ ਉਹ ਫਾਇਲਾਂ ਭੇਜ ਸਕਦੇ ਹੋ?,0.0,0.0,0.0,0.0,0.0,0.0,0.0,0.0,1.0
സഹായത്തിന് നന്ദی. 2988,0,സഹായത്തിന് നന്ദی. 2988,0.0,1.0,0.0,0.0,0.0,0.0,0.0,4.0,0.0
परीक्षेचे निकाल उद्या,0,परीक्षेचे निकाल उद्या,0.0,0.0,0.0,0.0,0.0,0.0,0.0,0.0,0.0
فوری: اپنا KYC اپ ڈیٹ کریں: https://short.url/pay-bill 6237,1,فوری: اپنا kyc اپ ڈیٹ کریں: https:/short.url/pay-bill 6237,1.0,1.0,0.0,0.0,0.0,0.0,1.0,4.0,0.0
પેકેજ ડિલિવર થઈ ગયું,0,પેકેજ ડિલિવર થઈ ગયું,0.0,0.0,0.0,0.0,0.0,0.0,0.0,0.0,0.0
अभिनंदन! तुम्ही 100000 ₹ जिंकले आहेत. मिळवा: http://tinyurl.com/secure-login,1,अभिनंदन! तुम्ही 100000 ₹ जिंकले आहेत. मिळवा: http:/tinyurl.com/secure-login,1.0,2.0,0.0,0.0,0.0,1.0,0.0,6.0,1.0
মই ঘৰ পাইছোঁ। 9230,0,মই ঘৰ পাইছোঁ। 9230,0.0,0.0,0.0,0.0,0.0,0.0,0.0,4.0,0.0
तुमचा Delhivery पार्सल थांबला आहे. शुल्क भरा: https://bank-kyc.net,1,तुमचा delhivery पार्सल थांबला आहे. शुल्क भरा: https:/bank-kyc.net,1.0,2.0,0.0,0.0,0.0,0.0,0.0,0.0,0.0
Jaipur-ত বৰষুণ দিছে নেকি?,0,jaipur-ত বৰষুণ দিছে নেকি?,0.0,0.0,0.0,0.0,0.0,0.0,0.0,0.0,1.0
അമ്മ ഫോൺ ചെയ്തിരുന്നു,0,അമ്മ ഫോൺ ചെയ്തിരുന്നു,0.0,0.0,0.0,0.0,0.0,0.0,0.0,0.0,0.0
کیا ہم آج مل رہے ہیں؟ 1344,0,کیا ہم آج مل رہے ہیں؟ 1344,0.0,0.0,0.0,0.0,0.0,0.0,0.0,4.0,0.0
Bangalore-তে কেমন আছো? 8149,0,bangalore-তে কেমন আছো? 8149,0.0,0.0,0.0,0.0,0.0,0.0,0.0,4.0,1.0
મહેરબાની કરીને ફાઇલ મોકલો. 2600,0,મહેરબાની કરીને ફાઇલ મોકલો. 2600,0.0,1.0,0.0,0.0,0.0,0.0,0.0,4.0,0.0
Mumbai ਕਿਵੇਂ ਹੈ? 8273,0,mumbai ਕਿਵੇਂ ਹੈ? 8273,0.0,0.0,0.0,0.0,0.0,0.0,0.0,4.0,1.0
Kolkata का मौसम कैसा है?,0,kolkata का मौसम कैसा है?,0.0,0.0,0.0,0.0,0.0,0.0,0.0,0.0,1.0
Chennai કેવું છે?,0,chennai કેવું છે?,0.0,0.0,0.0,0.0,0.0,0.0,0.0,0.0,1.0
Your flight is delayed by 2 hours. New departure: 8 PM,0,your flight is delayed by 2 hours. new departure: 8 pm,0.0,1.0,0.0,0.0,0.0,0.0,1.0,2.0,0.0
അടിയന്തിരം: നിങ്ങളുടെ KYC അപ്ഡേറ്റ് ചെയ്യുക: https://verify-secure.in 8057,1,അടിയന്തിരം: നിങ്ങളുടെ kyc അപ്ഡേറ്റ് ചെയ്യുക: https:/verify-secure.in 8057,1.0,1.0,0.0,1.0,0.0,0.0,1.0,4.0,0.0
സഹായത്തിന് നന്ദی. 5874,0,സഹായത്തിന് നന്ദی. 5874,0.0,1.0,0.0,0.0,0.0,0.0,0.0,4.0,0.0
ଆପଣଙ୍କ Amazon ପାର୍ସଲ୍ ଅଟକି ରହିଛି। ଶୁଳ୍କ ଦିଅନ୍ତୁ: https://short.url/pay-bill 5931,1,ଆପଣଙ୍କ amazon ପାର୍ସଲ୍ ଅଟକି ରହିଛି। ଶୁଳ୍କ ଦିଅନ୍ତୁ: https:/short.url/pay-bill 5931,1.0,1.0,0.0,0.0,0.0,0.0,0.0,4.0,0.0
আপনার Federal Bank অ্যাকাউন্ট বন্ধ করা হয়েছে। যাচাই করুন: http://bit.ly/update-now,1,আপনার federal bank অ্যাকাউন্ট বন্ধ করা হয়েছে। যাচাই করুন: http:/bit.ly/update-now,1.0,1.0,0.0,0.0,0.0,1.0,0.0,0.0,0.0
നിങ്ങളുടെ FedEx പാഴ്സൽ തടഞ്ഞുവെച്ചിരിക്കുന്നു. പണമടയ്ക്കുക: https://verify-secure.in,1,നിങ്ങളുടെ fedex പാഴ്സൽ തടഞ്ഞുവെച്ചിരിക്കുന്നു. പണമടയ്ക്കുക: https:/verify-secure.in,1.0,2.0,0.0,1.0,0.0,0.0,0.0,0.0,0.0
Thanks for the gift! 8552,0,thanks for the gift! 8552,0.0,0.0,0.0,0.0,0.0,0.0,0.0,4.0,1.0
घर पहुँच गया हूँ। 7963,0,घर पहुँच गया हूँ। 7963,0.0,0.0,0.0,0.0,0.0,0.0,0.0,4.0,0.0
क्या हम शाम को मिल रहे हैं? 5946,0,क्या हम शाम को मिल रहे हैं? 5946,0.0,0.0,0.0,0.0,0.0,0.0,0.0,4.0,1.0
অভিনন্দন! আপনি 75000 Rs জিতেছেন। এখানে পান: https://verify-secure.in,1,অভিনন্দন! আপনি 75000 rs জিতেছেন। এখানে পান: https:/verify-secure.in,1.0,1.0,0.0,1.0,0.0,0.0,0.0,5.0,1.0
Package from BlueDart is delayed. Pay fee: http://tinyurl.com/secure-login,1,package from bluedart is delayed. pay fee: http:/tinyurl.com/secure-login,1.0,2.0,0.0,0.0,0.0,1.0,0.0,0.0,0.0
ଦୟାକରି ଫାଇଲ୍ ପଠାନ୍ତୁ। 9085,0,ଦୟାକରି ଫାଇଲ୍ ପଠାନ୍ତୁ। 9085,0.0,0.0,0.0,0.0,0.0,0.0,0.0,4.0,0.0
ਕਿਰਪਾ ਕਰਕੇ ਫਾਈਲ ਭੇਜੋ। 9540,0,ਕਿਰਪਾ ਕਰਕੇ ਫਾਈਲ ਭੇਜੋ। 9540,0.0,0.0,0.0,0.0,0.0,0.0,0.0,4.0,0.0
అత్యవసరం: మీ KYCని వెంటనే అప్‌డేట్ చేయండి: http://goo.gl/verify-account 2983,1,అత్యవసరం: మీ kycని వెంటనే అప్‌డేట్ చేయండి: http:/goo.gl/verify-account 2983,1.0,1.0,0.0,1.0,0.0,1.0,1.0,4.0,0.0
ਜਰੂਰੀ: ਆਪਣਾ KYC ਅਪਡੇਟ ਕਰੋ: http://bit.ly/update-now 9077,1,ਜਰੂਰੀ: ਆਪਣਾ kyc ਅਪਡੇਟ ਕਰੋ: http:/bit.ly/update-now 9077,1.0,1.0,0.0,0.0,0.0,1.0,1.0,4.0,0.0
आपण आज भेटणार आहोत का? 9030,0,आपण आज भेटणार आहोत का? 9030,0.0,0.0,0.0,0.0,0.0,0.0,0.0,4.0,1.0
പച്ചക്കറികൾ വാങ്ങണം,0,പച്ചക്കറികൾ വാങ്ങണം,0.0,0.0,0.0,0.0,0.0,0.0,0.0,0.0,0.0
গতকালের সাহায্যের জন্য ধন্যবাদ,0,গতকালের সাহায্যের জন্য ধন্যবাদ,0.0,0.0,0.0,0.0,0.0,0.0,0.0,0.0,0.0
ಅಭಿನಂದನೆಗಳು! ನೀವು 75000 INR ಗೆದ್ದಿದ್ದೀರಿ. ಪಡೆಯಲು: http://tinyurl.com/secure-login,1,ಅಭಿನಂದನೆಗಳು! ನೀವು 75000 inr ಗೆದ್ದಿದ್ದೀರಿ. ಪಡೆಯಲು: http:/tinyurl.com/secure-login,1.0,2.0,0.0,0.0,0.0,1.0,1.0,5.0,1.0
మీ Zomato ఖాతాలో అసాధారణ కార్యాచరణ. తనిఖీ చేయండి: http://bit.ly/update-now,1,మీ zomato ఖాతాలో అసాధారణ కార్యాచరణ. తనిఖీ చేయండి: http:/bit.ly/update-now,1.0,2.0,0.0,0.0,0.0,1.0,0.0,0.0,0.0
آپ کا Kotak اکاؤنٹ معطل کر دیا گیا ہے۔ تصدیق کریں: https://short.url/pay-bill 4607,1,آپ کا kotak اکاؤنٹ معطل کر دیا گیا ہے۔ تصدیق کریں: https:/short.url/pay-bill 4607,1.0,1.0,0.0,0.0,0.0,0.0,0.0,4.0,0.0
Ahmedabadची सहल कशी होती? 2819,0,ahmedabadची सहल कशी होती? 2819,0.0,0.0,0.0,0.0,0.0,0.0,0.0,4.0,1.0
Flight confirmed for tomorrow. Check-in opens 24 hours before,0,flight confirmed for tomorrow. check-in opens 24 hours before,0.0,1.0,0.0,0.0,0.0,0.0,0.0,2.0,0.0
کیا ہم آج مل رہے ہیں؟ 6481,0,کیا ہم آج مل رہے ہیں؟ 6481,0.0,0.0,0.0,0.0,0.0,0.0,0.0,4.0,0.0
Team meeting at 4 PM today via Zoom,0,team meeting at 4 pm today via zoom,0.0,0.0,0.0,0.0,0.0,0.0,1.0,1.0,0.0
آپ کا PNB اکاؤنٹ معطل کر دیا گیا ہے۔ تصدیق کریں: http://claim-prize.top,1,آپ کا pnb اکاؤنٹ معطل کر دیا گیا ہے۔ تصدیق کریں: http:/claim-prize.top,1.0,1.0,0.0,0.0,0.0,0.0,1.0,0.0,0.0
আপোনাৰ বেংক একাউণ্ট বন্ধ কৰা হ'ব। তৎক্ষণাৎ ক্লিক কৰক,1,আপোনাৰ বেংক একাউণ্ট বন্ধ কৰা হ'ব। তৎক্ষণাৎ ক্লিক কৰক,0.0,0.0,0.0,0.0,0.0,0.0,0.0,0.0,0.0
आपका FedEx पार्सल रुका हुआ है। शुल्क भरें: https://bank-kyc.net 1787,1,आपका fedex पार्सल रुका हुआ है। शुल्क भरें: https:/bank-kyc.net 1787,1.0,1.0,0.0,0.0,0.0,0.0,0.0,4.0,0.0
The meeting is rescheduled to tomorrow. 2109,0,the meeting is rescheduled to tomorrow. 2109,0.0,1.0,0.0,0.0,0.0,0.0,0.0,4.0,0.0
فلپکارٹ: آپ کو 50% ڈسکاؤنٹ کوپن ملا۔ ابھی استعمال کریں,1,فلپکارٹ: آپ کو 50% ڈسکاؤنٹ کوپن ملا۔ ابھی استعمال کریں,0.0,0.0,0.0,0.0,0.0,0.0,0.0,2.0,0.0
कृपया फाईल पाठवा. 4304,0,कृपया फाईल पाठवा. 4304,0.0,1.0,0.0,0.0,0.0,0.0,0.0,4.0,0.0
ਗੂਗਲ ਪੇ: ਤੁਹਾਡੇ ਖਾਤੇ ਵਿੱਚ ਸ਼ੱਕੀ ਗਤੀਵਿਧੀ। ਜਾਂਚ ਕਰੋ,1,ਗੂਗਲ ਪੇ: ਤੁਹਾਡੇ ਖਾਤੇ ਵਿੱਚ ਸ਼ੱਕੀ ਗਤੀਵਿਧੀ। ਜਾਂਚ ਕਰੋ,0.0,0.0,0.0,0.0,0.0,0.0,0.0,0.0,0.0
জরুরী: আপনার KYC আপডেট করুন: http://tinyurl.com/secure-login,1,জরুরী: আপনার kyc আপডেট করুন: http:/tinyurl.com/secure-login,1.0,1.0,0.0,0.0,0.0,1.0,1.0,0.0,0.0
ਮਦਦ ਲਈ ਧੰਨਵਾਦ। 8570,0,ਮਦਦ ਲਈ ਧੰਨਵਾਦ। 8570,0.0,0.0,0.0,0.0,0.0,0.0,0.0,4.0,0.0
તમારું ICICI ખાતું બંધ કરી દેવામાં આવ્યું છે. અહીં ક્લિક કરો: https://verify-secure.in,1,તમારું icici ખાતું બંધ કરી દેવામાં આવ્યું છે. અહીં ક્લિક કરો: https:/verify-secure.in,1.0,2.0,0.0,1.0,0.0,0.0,1.0,0.0,0.0
అత్యవసరం: మీ KYCని వెంటనే అప్‌డేట్ చేయండి: https://bank-kyc.net,1,అత్యవసరం: మీ kycని వెంటనే అప్‌డేట్ చేయండి: https:/bank-kyc.net,1.0,1.0,0.0,0.0,0.0,0.0,1.0,0.0,0.0
ଆପଣଙ୍କ PayPal ଆକାଉଣ୍ଟ୍ ବନ୍ଦ କରାଯାଇଛି। ଯାଞ୍ଚ କରନ୍ତୁ: http://goo.gl/verify-account,1,ଆପଣଙ୍କ paypal ଆକାଉଣ୍ଟ୍ ବନ୍ଦ କରାଯାଇଛି। ଯାଞ୍ଚ କରନ୍ତୁ: http:/goo.gl/verify-account,1.0,1.0,0.0,1.0,0.0,1.0,0.0,0.0,0.0
ਤੁਹਾਡੇ Zomato ਖਾਤੇ ਵਿੱਚ ਸ਼ੱਕੀ ਗਤੀਵਿਧੀ। ਚੈੱਕ ਕਰੋ: http://tinyurl.com/secure-login,1,ਤੁਹਾਡੇ zomato ਖਾਤੇ ਵਿੱਚ ਸ਼ੱਕੀ ਗਤੀਵਿਧੀ। ਚੈੱਕ ਕਰੋ: http:/tinyurl.com/secure-login,1.0,1.0,0.0,0.0,0.0,1.0,0.0,0.0,0.0
ദയവായി ഫയൽ അയക്കൂ. 2181,0,ദയവായി ഫയൽ അയക്കൂ. 2181,0.0,1.0,0.0,0.0,0.0,0.0,0.0,4.0,0.0
Congratulations! You won 5000 INR. Claim: https://short.url/pay-bill,1,congratulations! you won 5000 inr. claim: https:/short.url/pay-bill,1.0,2.0,0.0,0.0,0.0,0.0,1.0,4.0,1.0
Delhi का मौसम कैसा है? 1693,0,delhi का मौसम कैसा है? 1693,0.0,0.0,0.0,0.0,0.0,0.0,0.0,4.0,1.0
ਤੁਹਾਡੇ Uber ਖਾਤੇ ਵਿੱਚ ਸ਼ੱਕੀ ਗਤੀਵਿਧੀ। ਚੈੱਕ ਕਰੋ: http://goo.gl/verify-account,1,ਤੁਹਾਡੇ uber ਖਾਤੇ ਵਿੱਚ ਸ਼ੱਕੀ ਗਤੀਵਿਧੀ। ਚੈੱਕ ਕਰੋ: http:/goo.gl/verify-account,1.0,1.0,0.0,1.0,0.0,1.0,0.0,0.0,0.0
