text,label,clean_text,url_count,dot_count,has_at_symbol,urgency_flag,threat_flag,suspicious_domain_flag,caps_word_count,digit_count,special_char_count
আমি আজিয়েই লগ পাম নেকি? 3939,0,আমি আজিয়েই লগ পাম নেকি? 3939,0.0,0.0,0.0,0.0,0.0,0.0,0.0,4.0,1.0
ଆପଣଙ୍କ BlueDart ପାର୍ସଲ୍ ଅଟକି ରହିଛି। ଶୁଳ୍କ ଦିଅନ୍ତୁ: http://bit.ly/update-now 1923,1,ଆପଣଙ୍କ bluedart ପାର୍ସଲ୍ ଅଟକି ରହିଛି। ଶୁଳ୍କ ଦିଅନ୍ତୁ: http:/bit.ly/update-now 1923,1.0,1.0,0.0,0.0,0.0,1.0,0.0,4.0,0.0
Package from BlueDart is delayed. Pay fee: https://verify-secure.in,1,package from bluedart is delayed. pay fee: https:/verify-secure.in,1.0,2.0,0.0,1.0,0.0,0.0,0.0,0.0,0.0
வாழ்த்துக்கள்! நீங்கள் 100000 Rs வென்றுள்ளீர்கள். பெற: http://goo.gl/verify-account,1,வாழ்த்துக்கள்! நீங்கள் 100000 rs வென்றுள்ளீர்கள். பெற: http:/goo.gl/verify-account,1.0,2.0,0.0,1.0,0.0,1.0,0.0,6.0,1.0
सुरक्षा चेतावनी: असामान्य गतिविधि। तुरंत सत्यापित करें,1,सुरक्षा चेतावनी: असामान्य गतिविधि। तुरंत सत्यापित करें,0.0,0.0,0.0,1.0,0.0,0.0,0.0,0.0,0.0
అమ్మ ఫోన్ చేసింది,0,అమ్మ ఫోన్ చేసింది,0.0,0.0,0.0,0.0,0.0,0.0,0.0,0.0,0.0
آپ کا Delhivery پارسل رکا ہوا ہے۔ فیس ادا کریں: http://tinyurl.com/secure-login,1,آپ کا delhivery پارسل رکا ہوا ہے۔ فیس ادا کریں: http:/tinyurl.com/secure-login,1.0,1.0,0.0,0.0,0.0,1.0,0.0,0.0,0.0
Pune کا سفر کیسا رہا؟ 4737,0,pune کا سفر کیسا رہا؟ 4737,0.0,0.0,0.0,0.0,0.0,0.0,0.0,4.0,0.0
ನಾವು ಇಂದು ಭೇಟಿಯಾಗೋಣವೇ? 1953,0,ನಾವು ಇಂದು ಭೇಟಿಯಾಗೋಣವೇ? 1953,0.0,0.0,0.0,0.0,0.0,0.0,0.0,4.0,1.0
अति आवश्यक: आपका KYC अधूरा है। अभी अपडेट करें: https://short.url/pay-bill 4768,1,अति आवश्यक: आपका kyc अधूरा है। अभी अपडेट करें: https:/short.url/pay-bill 4768,1.0,1.0,0.0,1.0,0.0,0.0,1.0,4.0,0.0
ನಿಮ್ಮ DHL ಪಾರ್ಸೆಲ್ ಬಾಕಿಯಿದೆ. ಹಣ ಪಾವತಿಸಿ: http://goo.gl/verify-account,1,ನಿಮ್ಮ dhl ಪಾರ್ಸೆಲ್ ಬಾಕಿಯಿದೆ. ಹಣ ಪಾವತಿಸಿ: http:/goo.gl/verify-account,1.0,2.0,0.0,1.0,0.0,1.0,1.0,0.0,0.0
فوری: اپنا KYC اپ ڈیٹ کریں: http://tinyurl.com/secure-login 7059,1,فوری: اپنا kyc اپ ڈیٹ کریں: http:/tinyurl.com/secure-login 7059,1.0,1.0,0.0,0.0,0.0,1.0,1.0,4.0,0.0
গাড়ীৰ সেৱা কাইলৈ পুৱা 10 বজাত,0,গাড়ীৰ সেৱা কাইলৈ পুৱা 10 বজাত,0.0,0.0,0.0,0.0,0.0,0.0,0.0,2.0,0.0
आपका XpressBees पार्सल रुका हुआ है। शुल्क भरें: http://claim-prize.top,1,आपका xpressbees पार्सल रुका हुआ है। शुल्क भरें: http:/claim-prize.top,1.0,1.0,0.0,0.0,0.0,0.0,0.0,0.0,0.0
તાકીદે: તમારું KYC અપડેટ કરો: https://verify-secure.in 9076,1,તાકીદે: તમારું kyc અપડેટ કરો: https:/verify-secure.in 9076,1.0,1.0,0.0,1.0,0.0,0.0,1.0,4.0,0.0
मी घरी पोहोचलो. 1703,0,मी घरी पोहोचलो. 1703,0.0,1.0,0.0,0.0,0.0,0.0,0.0,4.0,0.0
সহায়ৰ বাবে ধন্যবাদ। 3146,0,সহায়ৰ বাবে ধন্যবাদ। 3146,0.0,0.0,0.0,0.0,0.0,0.0,0.0,4.0,0.0
অভিনন্দন! আপনি 10000 Rs জিতেছেন। এখানে পান: http://bit.ly/update-now,1,অভিনন্দন! আপনি 10000 rs জিতেছেন। এখানে পান: http:/bit.ly/update-now,1.0,1.0,0.0,0.0,0.0,1.0,0.0,5.0,1.0
জন্মদিনৰ শুভকামনা জনালোঁ! 7616,0,জন্মদিনৰ শুভকামনা জনালোঁ! 7616,0.0,0.0,0.0,0.0,0.0,0.0,0.0,4.0,1.0
Your Federal Bank account is locked. Verify at https://bank-kyc.net,1,your federal bank account is locked. verify at https:/bank-kyc.net,1.0,2.0,0.0,1.0,0.0,0.0,0.0,0.0,0.0
సహాయం చేసినందుకు ధನ್ಯవాదాలు. 1260,0,సహాయం చేసినందుకు ధನ್ಯవాదాలు. 1260,0.0,1.0,0.0,0.0,0.0,0.0,0.0,4.0,0.0
आपके Facebook खाते में संदिग्ध गतिविधि। जांचें: https://bank-kyc.net,1,आपके facebook खाते में संदिग्ध गतिविधि। जांचें: https:/bank-kyc.net,1.0,1.0,0.0,0.0,0.0,0.0,0.0,0.0,0.0
നിങ്ങളുടെ ബാങ്ക് അക്കൗണ്ട് അടയ്ക്കപ്പെടും. ഉടൻ ക്ലിക്ക് ചെയ്യുക,1,നിങ്ങളുടെ ബാങ്ക് അക്കൗണ്ട് അടയ്ക്കപ്പെടും. ഉടൻ ക്ലിക്ക് ചെയ്യുക,0.0,1.0,0.0,0.0,0.0,0.0,0.0,0.0,0.0
ଆପଣଙ୍କ Swiggy ଆକାଉଣ୍ଟରେ ଅସ୍ୱାଭାବିକ କାର୍ଯ୍ୟକଳାପ। ଦେଖନ୍ତୁ: https://short.url/pay-bill 1828,1,ଆପଣଙ୍କ swiggy ଆକାଉଣ୍ଟରେ ଅସ୍ୱାଭାବିକ କାର୍ଯ୍ୟକଳାପ। ଦେଖନ୍ତୁ: https:/short.url/pay-bill 1828,1.0,1.0,0.0,0.0,0.0,0.0,0.0,4.0,0.0
तुमच्या Uber खात्यात संशयास्पद हालचाल. तपासा: http://goo.gl/verify-account 4827,1,तुमच्या uber खात्यात संशयास्पद हालचाल. तपासा: http:/goo.gl/verify-account 4827,1.0,2.0,0.0,1.0,0.0,1.0,0.0,4.0,0.0
ଆପଣଙ୍କ Hotstar ଆକାଉଣ୍ଟରେ ଅସ୍ୱାଭାବିକ କାର୍ଯ୍ୟକଳାପ। ଦେଖନ୍ତୁ: http://goo.gl/verify-account,1,ଆପଣଙ୍କ hotstar ଆକାଉଣ୍ଟରେ ଅସ୍ୱାଭାବିକ କାର୍ଯ୍ୟକଳାପ। ଦେଖନ୍ତୁ: http:/goo.gl/verify-account,1.0,1.0,0.0,1.0,0.0,1.0,0.0,0.0,0.0
آپ کا Axis Bank اکاؤنٹ معطل کر دیا گیا ہے۔ تصدیق کریں: https://short.url/pay-bill,1,آپ کا axis bank اکاؤنٹ معطل کر دیا گیا ہے۔ تصدیق کریں: https:/short.url/pay-bill,1.0,1.0,0.0,0.0,0.0,0.0,0.0,0.0,0.0
Mumbai-তে কেমন আছো? 2131,0,mumbai-তে কেমন আছো? 2131,0.0,0.0,0.0,0.0,0.0,0.0,0.0,4.0,1.0
હું ઘરે પહોંચી ગયો છું. 3313,0,હું ઘરે પહોંચી ગયો છું. 3313,0.0,1.0,0.0,0.0,0.0,0.0,0.0,4.0,0.0
ನಿಮ್ಮ Netflix ಖಾತೆಯಲ್ಲಿ ಅಸಹಜ ಚಟುವಟಿಕೆ. ಪರಿಶೀಲಿಸಿ: http://claim-prize.top 9502,1,ನಿಮ್ಮ netflix ಖಾತೆಯಲ್ಲಿ ಅಸಹಜ ಚಟುವಟಿಕೆ. ಪರಿಶೀಲಿಸಿ: http:/claim-prize.top 9502,1.0,2.0,0.0,0.0,0.0,0.0,0.0,4.0,0.0
అత్యవసరం: మీ KYCని వెంటనే అప్‌డేట్ చేయండి: http://goo.gl/verify-account 2810,1,అత్యవసరం: మీ kycని వెంటనే అప్‌డేట్ చేయండి: http:/goo.gl/verify-account 2810,1.0,1.0,0.0,1.0,0.0,1.0,1.0,4.0,0.0
Thanks for the gift! 5000,0,thanks for the gift! 5000,0.0,0.0,0.0,0.0,0.0,0.0,0.0,4.0,1.0
ಸಹಾಯಕ್ಕಾಗಿ ಧನ್ಯವಾದಗಳು. 2322,0,ಸಹಾಯಕ್ಕಾಗಿ ಧನ್ಯವಾದಗಳು. 2322,0.0,1.0,0.0,0.0,0.0,0.0,0.0,4.0,0.0
നിങ്ങളുടെ Flipkart അക്കൗണ്ടിൽ സംശയാസ്പദമായ നീക്കം. പരിശോധിക്കുക: http://bit.ly/update-now,1,നിങ്ങളുടെ flipkart അക്കൗണ്ടിൽ സംശയാസ്പദമായ നീക്കം. പരിശോധിക്കുക: http:/bit.ly/update-now,1.0,2.0,0.0,0.0,0.0,1.0,0.0,0.0,0.0
உதவிக்கு நன்றி. 3792,0,உதவிக்கு நன்றி. 3792,0.0,1.0,0.0,0.0,0.0,0.0,0.0,4.0,0.0
ମୁଁ ଘରେ ପହଞ୍ଚି ଗଲିଣି। 6790,0,ମୁଁ ଘରେ ପହଞ୍ଚି ଗଲିଣି। 6790,0.0,0.0,0.0,0.0,0.0,0.0,0.0,4.0,0.0
Thanks for the gift! 2700,0,thanks for the gift! 2700,0.0,0.0,0.0,0.0,0.0,0.0,0.0,4.0,1.0
Final notice: Your Amazon membership expires today. Renew: https://short.url/pay-bill,1,final notice: your amazon membership expires today. renew: https:/short.url/pay-bill,1.0,2.0,0.0,0.0,0.0,0.0,0.0,0.0,0.0
URGENT: Your Kotak KYC is pending. Update now: http://goo.gl/verify-account,1,urgent: your kotak kyc is pending. update now: http:/goo.gl/verify-account,1.0,2.0,0.0,1.0,0.0,1.0,2.0,0.0,0.0
உதவிக்கு நன்றி. 9689,0,உதவிக்கு நன்றி. 9689,0.0,1.0,0.0,0.0,0.0,0.0,0.0,4.0,0.0
మనం సాయంత్రం కలుద్దామా? 7586,0,మనం సాయంత్రం కలుద్దామా? 7586,0.0,0.0,0.0,0.0,0.0,0.0,0.0,4.0,1.0
পরীক্ষার রেজাল্ট আগামীকাল,0,পরীক্ষার রেজাল্ট আগামীকাল,0.0,0.0,0.0,0.0,0.0,0.0,0.0,0.0,0.0
પેટીએમ: તમારા એકાઉન્ટમાં શંકાસ્પદ પ્રવૃત્તિ। તપાસો,1,પેટીએમ: તમારા એકાઉન્ટમાં શંકાસ્પદ પ્રવૃત્તિ। તપાસો,0.0,0.0,0.0,0.0,0.0,0.0,0.0,0.0,0.0
আপনার প্যান কার্ড এক্সপায়ার হবে। এখনই রিনিউ করুন,1,আপনার প্যান কার্ড এক্সপায়ার হবে। এখনই রিনিউ করুন,0.0,0.0,0.0,0.0,0.0,0.0,0.0,0.0,0.0
ଆପଣଙ୍କ Ecom Express ପାର୍ସଲ୍ ଅଟକି ରହିଛି। ଶୁଳ୍କ ଦିଅନ୍ତୁ: http://claim-prize.top,1,ଆପଣଙ୍କ ecom express ପାର୍ସଲ୍ ଅଟକି ରହିଛି। ଶୁଳ୍କ ଦିଅନ୍ତୁ: http:/claim-prize.top,1.0,1.0,0.0,0.0,0.0,0.0,0.0,0.0,0.0
অভিনন্দন! আপুনি 50000 Rs জিকিছে। ইয়াত পাওক: https://short.url/pay-bill,1,অভিনন্দন! আপুনি 50000 rs জিকিছে। ইয়াত পাওক: https:/short.url/pay-bill,1.0,1.0,0.0,0.0,0.0,0.0,0.0,5.0,1.0
کیا ہم آج مل رہے ہیں؟,0,کیا ہم آج مل رہے ہیں؟,0.0,0.0,0.0,0.0,0.0,0.0,0.0,0.0,0.0
ଆମେ ଆଜି ଦେଖା ହେବା କି? 5493,0,ଆମେ ଆଜି ଦେଖା ହେବା କି? 5493,0.0,0.0,0.0,0.0,0.0,0.0,0.0,4.0,1.0
ਜਰੂਰੀ: ਆਪਣਾ KYC ਅਪਡੇਟ ਕਰੋ: https://verify-secure.in,1,ਜਰੂਰੀ: ਆਪਣਾ kyc ਅਪਡੇਟ ਕਰੋ: https:/verify-secure.in,1.0,1.0,0.0,1.0,0.0,0.0,1.0,0.0,0.0
Your PNB account is locked. Verify at http://goo.gl/verify-account,1,your pnb account is locked. verify at http:/goo.gl/verify-account,1.0,2.0,0.0,1.0,0.0,1.0,1.0,0.0,0.0
घर पहुँच गया हूँ। 9629,0,घर पहुँच गया हूँ। 9629,0.0,0.0,0.0,0.0,0.0,0.0,0.0,4.0,0.0
مبارک ہو! آپ نے 25000 INR جیتے ہیں۔ کلیم کریں: http://tinyurl.com/secure-login,1,مبارک ہو! آپ نے 25000 inr جیتے ہیں۔ کلیم کریں: http:/tinyurl.com/secure-login,1.0,1.0,0.0,0.0,0.0,1.0,1.0,5.0,1.0
Hyderabad-ൽ മഴയുണ്ടോ?,0,hyderabad-ൽ മഴയുണ്ടോ?,0.0,0.0,0.0,0.0,0.0,0.0,0.0,0.0,1.0
શું આપણે આજે મળીશું? 5043,0,શું આપણે આજે મળીશું? 5043,0.0,0.0,0.0,0.0,0.0,0.0,0.0,4.0,1.0
மருத்துவமனைக்குச் செல்ல வேண்டும்,0,மருத்துவமனைக்குச் செல்ல வேண்டும்,0.0,0.0,0.0,0.0,0.0,0.0,0.0,0.0,0.0
অভিনন্দন! আপুনি 25000 BDT জিকিছে। ইয়াত পাওক: https://short.url/pay-bill 7136,1,অভিনন্দন! আপুনি 25000 bdt জিকিছে। ইয়াত পাওক: https:/short.url/pay-bill 7136,1.0,1.0,0.0,0.0,0.0,0.0,1.0,9.0,1.0
வாழ்த்துக்கள்! நீங்கள் 100000 ₹ வென்றுள்ளீர்கள். பெற: https://short.url/pay-bill,1,வாழ்த்துக்கள்! நீங்கள் 100000 ₹ வென்றுள்ளீர்கள். பெற: https:/short.url/pay-bill,1.0,2.0,0.0,0.0,0.0,0.0,0.0,6.0,1.0
Thanks for the gift! 3814,0,thanks for the gift! 3814,0.0,0.0,0.0,0.0,0.0,0.0,0.0,4.0,1.0
मदद के लिए धन्यवाद। 4688,0,मदद के लिए धन्यवाद। 4688,0.0,0.0,0.0,0.0,0.0,0.0,0.0,4.0,0.0
ਜਰੂਰੀ: ਆਪਣਾ KYC ਅਪਡੇਟ ਕਰੋ: https://verify-secure.in 6940,1,ਜਰੂਰੀ: ਆਪਣਾ kyc ਅਪਡੇਟ ਕਰੋ: https:/verify-secure.in 6940,1.0,1.0,0.0,1.0,0.0,0.0,1.0,4.0,0.0
ತುರ್ತು: ನಿಮ್ಮ KYC ನವೀಕರಿಸಿ: http://claim-prize.top 6100,1,ತುರ್ತು: ನಿಮ್ಮ kyc ನವೀಕರಿಸಿ: http:/claim-prize.top 6100,1.0,1.0,0.0,0.0,0.0,0.0,1.0,4.0,0.0
ଆପଣଙ୍କ Airtel ଆକାଉଣ୍ଟରେ ଅସ୍ୱାଭାବିକ କାର୍ଯ୍ୟକଳାପ। ଦେଖନ୍ତୁ: https://short.url/pay-bill,1,ଆପଣଙ୍କ airtel ଆକାଉଣ୍ଟରେ ଅସ୍ୱାଭାବିକ କାର୍ଯ୍ୟକଳାପ। ଦେଖନ୍ତୁ: https:/short.url/pay-bill,1.0,1.0,0.0,0.0,0.0,0.0,0.0,0.0,0.0
Pune کا سفر کیسا رہا؟ 4426,0,pune کا سفر کیسا رہا؟ 4426,0.0,0.0,0.0,0.0,0.0,0.0,0.0,4.0,0.0
ਤੁਹਾਡਾ HDFC ਖਾਤਾ ਬੰਦ ਕਰ ਦਿੱਤਾ ਗਿਆ ਹੈ। ਇੱਥੇ ਦੇਖੋ: http://tinyurl.com/secure-login,1,ਤੁਹਾਡਾ hdfc ਖਾਤਾ ਬੰਦ ਕਰ ਦਿੱਤਾ ਗਿਆ ਹੈ। ਇੱਥੇ ਦੇਖੋ: http:/tinyurl.com/secure-login,1.0,1.0,0.0,0.0,0.0,1.0,1.0,0.0,0.0
அவசரம்: உங்கள் KYC-ஐ உடனே புதுப்பிக்கவும்: http://goo.gl/verify-account,1,அவசரம்: உங்கள் kyc-ஐ உடனே புதுப்பிக்கவும்: http:/goo.gl/verify-account,1.0,1.0,0.0,1.0,0.0,1.0,1.0,0.0,0.0
பிறந்தநாள் வாழ்த்துக்கள்! 4490,0,பிறந்தநாள் வாழ்த்துக்கள்! 4490,0.0,0.0,0.0,0.0,0.0,0.0,0.0,4.0,1.0
ತುರ್ತು: ನಿಮ್ಮ KYC ನವೀಕರಿಸಿ: http://goo.gl/verify-account 2796,1,ತುರ್ತು: ನಿಮ್ಮ kyc ನವೀಕರಿಸಿ: http:/goo.gl/verify-account 2796,1.0,1.0,0.0,1.0,0.0,1.0,1.0,4.0,0.0
ജന്മദിനാശംസകൾ! 4247,0,ജന്മദിനാശംസകൾ! 4247,0.0,0.0,0.0,0.0,0.0,0.0,0.0,4.0,1.0
ਮਦਦ ਲਈ ਧੰਨਵਾਦ। 4893,0,ਮਦਦ ਲਈ ਧੰਨਵਾਦ। 4893,0.0,0.0,0.0,0.0,0.0,0.0,0.0,4.0,0.0
Jaipur ਕਿਵੇਂ ਹੈ? 2127,0,jaipur ਕਿਵੇਂ ਹੈ? 2127,0.0,0.0,0.0,0.0,0.0,0.0,0.0,4.0,1.0
ਤੁਹਾਡੇ Snapchat ਖਾਤੇ ਵਿੱਚ ਸ਼ੱਕੀ ਗਤੀਵਿਧੀ। ਚੈੱਕ ਕਰੋ: http://goo.gl/verify-account,1,ਤੁਹਾਡੇ snapchat ਖਾਤੇ ਵਿੱਚ ਸ਼ੱਕੀ ਗਤੀਵਿਧੀ। ਚੈੱਕ ਕਰੋ: http:/goo.gl/verify-account,1.0,1.0,0.0,1.0,0.0,1.0,0.0,0.0,0.0
તમારું ઇલેક્શન આઇડી સ્થગિત કરાશે। તરત જ વેરિફાઈ કરો,1,તમારું ઇલેક્શન આઇડી સ્થગિત કરાશે। તરત જ વેરિફાઈ કરો,0.0,0.0,0.0,0.0,0.0,0.0,0.0,0.0,0.0
పుట్టినరోజు శుభాకాంక్షలు! 7315,0,పుట్టినరోజు శుభాకాంక్షలు! 7315,0.0,0.0,0.0,0.0,0.0,0.0,0.0,4.0,1.0
Hyderabadలో వాతావరణం ఎలా ఉంది? 3657,0,hyderabadలో వాతావరణం ఎలా ఉంది? 3657,0.0,0.0,0.0,0.0,0.0,0.0,0.0,4.0,1.0
మీ IndusInd ఖాతా నిలిపివేయబడింది. ధృవీకరించండి: http://bit.ly/update-now,1,మీ indusind ఖాతా నిలిపివేయబడింది. ధృవీకరించండి: http:/bit.ly/update-now,1.0,2.0,0.0,1.0,0.0,1.0,0.0,0.0,0.0
ദയവായി ഫയൽ അയക്കൂ. 9586,0,ദയവായി ഫയൽ അയക്കൂ. 9586,0.0,1.0,0.0,0.0,0.0,0.0,0.0,4.0,0.0
तुमचा Delhivery पार्सल थांबला आहे. शुल्क भरा: http://claim-prize.top,1,तुमचा delhivery पार्सल थांबला आहे. शुल्क भरा: http:/claim-prize.top,1.0,2.0,0.0,0.0,0.0,0.0,0.0,0.0,0.0
तातडीचे: तुमचे KYC अपडेट करा: http://claim-prize.top 9129,1,तातडीचे: तुमचे kyc अपडेट करा: http:/claim-prize.top 9129,1.0,1.0,0.0,0.0,0.0,0.0,1.0,4.0,0.0
ਕੀ ਅਸੀਂ ਅੱਜ ਮਿਲ ਰਹੇ ਹਾਂ? 7777,0,ਕੀ ਅਸੀਂ ਅੱਜ ਮਿਲ ਰਹੇ ਹਾਂ? 7777,0.0,0.0,0.0,0.0,0.0,0.0,0.0,4.0,1.0
Mumbai ଯାତ୍ରା କେମିତି ଥିଲା?,0,mumbai ଯାତ୍ରା କେମିତି ଥିଲା?,0.0,0.0,0.0,0.0,0.0,0.0,0.0,0.0,1.0
உங்கள் Google கணக்கில் அசாதாரண செயல்பாடு. சரிபார்க்க: http://bit.ly/update-now,1,உங்கள் google கணக்கில் அசாதாரண செயல்பாடு. சரிபார்க்க: http:/bit.ly/update-now,1.0,2.0,0.0,0.0,0.0,1.0,0.0,0.0,0.0
ಅಭಿನಂದನೆಗಳು! ನೀವು 100000 Rs ಗೆದ್ದಿದ್ದೀರಿ. ಪಡೆಯಲು: https://verify-secure.in,1,ಅಭಿನಂದನೆಗಳು! ನೀವು 100000 rs ಗೆದ್ದಿದ್ದೀರಿ. ಪಡೆಯಲು: https:/verify-secure.in,1.0,2.0,0.0,1.0,0.0,0.0,0.0,6.0,1.0
మీ Amazon పార్శిల్ ఆగిపోయింది. చెల్లించండి: https://verify-secure.in 3214,1,మీ amazon పార్శిల్ ఆగిపోయింది. చెల్లించండి: https:/verify-secure.in 3214,1.0,2.0,0.0,1.0,0.0,0.0,0.0,4.0,0.0
અભિનંદન! તમે 25000 BDT જીત્યા છે. મેળવો: http://goo.gl/verify-account,1,અભિનંદન! તમે 25000 bdt જીત્યા છે. મેળવો: http:/goo.gl/verify-account,1.0,2.0,0.0,1.0,0.0,1.0,1.0,5.0,1.0
जन्मदिन की बहुत-बहुत बधाई! 1916,0,जन्मदिन की बहुत-बहुत बधाई! 1916,0.0,0.0,0.0,0.0,0.0,0.0,0.0,4.0,1.0
મહેરબાની કરીને ફાઇલ મોકલો. 4027,0,મહેરબાની કરીને ફાઇલ મોકલો. 4027,0.0,1.0,0.0,0.0,0.0,0.0,0.0,4.0,0.0
ਕੀ ਅਸੀਂ ਅੱਜ ਮਿਲ ਰਹੇ ਹਾਂ? 5644,0,ਕੀ ਅਸੀਂ ਅੱਜ ਮਿਲ ਰਹੇ ਹਾਂ? 5644,0.0,0.0,0.0,0.0,0.0,0.0,0.0,4.0,1.0
तुमच्या Zomato खात्यात संशयास्पद हालचाल. तपासा: https://bank-kyc.net,1,तुमच्या zomato खात्यात संशयास्पद हालचाल. तपासा: https:/bank-kyc.net,1.0,2.0,0.0,0.0,0.0,0.0,0.0,0.0,0.0
అభినందనలు! మీరు 5000 INR గెలుచుకున్నారు. క్లెయిమ్ చేయండి: http://bit.ly/update-now,1,అభినందనలు! మీరు 5000 inr గెలుచుకున్నారు. క్లెయిమ్ చేయండి: http:/bit.ly/update-now,1.0,2.0,0.0,0.0,0.0,1.0,1.0,4.0,1.0
ಹುಟ್ಟುಹಬ್ಬದ ಶುಭಾಶಯಗಳು! 4830,0,ಹುಟ್ಟುಹಬ್ಬದ ಶುಭಾಶಯಗಳು! 4830,0.0,0.0,0.0,0.0,0.0,0.0,0.0,4.0,1.0
ଜରୁରୀ: ଆପଣଙ୍କ KYC ଅପଡੇଟ୍ କରନ୍ତୁ: https://bank-kyc.net 8571,1,ଜରୁରୀ: ଆପଣଙ୍କ kyc ଅପଡੇଟ୍ କରନ୍ତୁ: https:/bank-kyc.net 8571,1.0,1.0,0.0,0.0,0.0,0.0,1.0,4.0,0.0
Hyderabad ଯାତ୍ରା କେମିତି ଥିଲା?,0,hyderabad ଯାତ୍ରା କେମିତି ଥିଲା?,0.0,0.0,0.0,0.0,0.0,0.0,0.0,0.0,1.0
आपका Axis Bank खाता ब्लॉक कर दिया गया है। यहाँ सत्यापित करें: http://tinyurl.com/secure-login,1,आपका axis bank खाता ब्लॉक कर दिया गया है। यहाँ सत्यापित करें: http:/tinyurl.com/secure-login,1.0,1.0,0.0,1.0,0.0,1.0,0.0,0.0,0.0
ഞാൻ വീട്ടിലെത്തി. 6877,0,ഞാൻ വീട്ടിലെത്തി. 6877,0.0,1.0,0.0,0.0,0.0,0.0,0.0,4.0,0.0
ਜਰੂਰੀ: ਆਪਣਾ KYC ਅਪਡੇਟ ਕਰੋ: https://bank-kyc.net 8077,1,ਜਰੂਰੀ: ਆਪਣਾ kyc ਅਪਡੇਟ ਕਰੋ: https:/bank-kyc.net 8077,1.0,1.0,0.0,0.0,0.0,0.0,1.0,4.0,0.0
ಹುಟ್ಟುಹಬ್ಬದ ಶುಭಾಶಯಗಳು! 9316,0,ಹುಟ್ಟುಹಬ್ಬದ ಶುಭಾಶಯಗಳು! 9316,0.0,0.0,0.0,0.0,0.0,0.0,0.0,4.0,1.0
জন্মদিনৰ শুভকামনা জনালোঁ! 6909,0,জন্মদিনৰ শুভকামনা জনালোঁ! 6909,0.0,0.0,0.0,0.0,0.0,0.0,0.0,4.0,1.0
तुमच्या Flipkart खात्यात संशयास्पद हालचाल. तपासा: http://goo.gl/verify-account,1,तुमच्या flipkart खात्यात संशयास्पद हालचाल. तपासा: http:/goo.gl/verify-account,1.0,2.0,0.0,1.0,0.0,1.0,0.0,0.0,0.0
Jaipur-তে কেমন আছো? 4502,0,jaipur-তে কেমন আছো? 4502,0.0,0.0,0.0,0.0,0.0,0.0,0.0,4.0,1.0
ଆପଣଙ୍କ Zomato ଆକାଉଣ୍ଟରେ ଅସ୍ୱାଭାବିକ କାର୍ଯ୍ୟକଳାପ। ଦେଖନ୍ତୁ: http://claim-prize.top,1,ଆପଣଙ୍କ zomato ଆକାଉଣ୍ଟରେ ଅସ୍ୱାଭାବିକ କାର୍ଯ୍ୟକଳାପ। ଦେଖନ୍ତୁ: http:/claim-prize.top,1.0,1.0,0.0,0.0,0.0,0.0,0.0,0.0,0.0
बधाई हो! आपने 25000 Rs जीते हैं। दावा करें: http://tinyurl.com/secure-login,1,बधाई हो! आपने 25000 rs जीते हैं। दावा करें: http:/tinyurl.com/secure-login,1.0,1.0,0.0,0.0,0.0,1.0,0.0,5.0,1.0
ଜରୁରୀ: ଆପଣଙ୍କ KYC ଅପଡੇଟ୍ କରନ୍ତୁ: http://bit.ly/update-now 4630,1,ଜରୁରୀ: ଆପଣଙ୍କ kyc ଅପଡੇଟ୍ କରନ୍ତୁ: http:/bit.ly/update-now 4630,1.0,1.0,0.0,0.0,0.0,1.0,1.0,4.0,0.0
നാളെ അവധി,0,നാളെ അവധി,0.0,0.0,0.0,0.0,0.0,0.0,0.0,0.0,0.0
സഹായത്തിന് നന്ദی. 6330,0,സഹായത്തിന് നന്ദی. 6330,0.0,1.0,0.0,0.0,0.0,0.0,0.0,4.0,0.0
Chennai का मौसम कैसा है? 3983,0,chennai का मौसम कैसा है? 3983,0.0,0.0,0.0,0.0,0.0,0.0,0.0,4.0,1.0
জৰুৰী: আপোনাৰ KYC আপডেট কৰক: https://bank-kyc.net,1,জৰুৰী: আপোনাৰ kyc আপডেট কৰক: https:/bank-kyc.net,1.0,1.0,0.0,0.0,0.0,0.0,1.0,0.0,0.0
আজ কি দেখা হবে? 3399,0,আজ কি দেখা হবে? 3399,0.0,0.0,0.0,0.0,0.0,0.0,0.0,4.0,1.0
আপোনাৰ Netflix একাউণ্টত অস্বাভাৱিক কাৰ্যকলাপ। চাওক: http://bit.ly/update-now,1,আপোনাৰ netflix একাউণ্টত অস্বাভাৱিক কাৰ্যকলাপ। চাওক: http:/bit.ly/update-now,1.0,1.0,0.0,0.0,0.0,1.0,0.0,0.0,0.0
సహాయం చేసినందుకు ధನ್ಯవాదాలు. 2102,0,సహాయం చేసినందుకు ధನ್ಯవాదాలు. 2102,0.0,1.0,0.0,0.0,0.0,0.0,0.0,4.0,0.0
Ahmedabad કેવું છે?,0,ahmedabad કેવું છે?,0.0,0.0,0.0,0.0,0.0,0.0,0.0,0.0,1.0
வீடு வந்து சேர்ந்தேன். 6251,0,வீடு வந்து சேர்ந்தேன். 6251,0.0,1.0,0.0,0.0,0.0,0.0,0.0,4.0,0.0
ತುರ್ತು: ನಿಮ್ಮ KYC ನವೀಕರಿಸಿ: http://tinyurl.com/secure-login 9182,1,ತುರ್ತು: ನಿಮ್ಮ kyc ನವೀಕರಿಸಿ: http:/tinyurl.com/secure-login 9182,1.0,1.0,0.0,0.0,0.0,1.0,1.0,4.0,0.0
ଆପଣଙ୍କ Shiprocket ପାର୍ସଲ୍ ଅଟକି ରହିଛି। ଶୁଳ୍କ ଦିଅନ୍ତୁ: https://verify-secure.in 8775,1,ଆପଣଙ୍କ shiprocket ପାର୍ସଲ୍ ଅଟକି ରହିଛି। ଶୁଳ୍କ ଦିଅନ୍ତୁ: https:/verify-secure.in 8775,1.0,1.0,0.0,1.0,0.0,0.0,0.0,4.0,0.0
