text,label,clean_text,url_count,dot_count,has_at_symbol,urgency_flag,threat_flag,suspicious_domain_flag,caps_word_count,digit_count,special_char_count
সহায়ৰ বাবে ধন্যবাদ। 9119,0,সহায়ৰ বাবে ধন্যবাদ। 9119,0.0,0.0,0.0,0.0,0.0,0.0,0.0,4.0,0.0
Are we meeting for lunch at Monday? 6451,0,are we meeting for lunch at monday? 6451,0.0,0.0,0.0,0.0,0.0,0.0,0.0,4.0,1.0
آپ کے Netflix اکاؤنٹ میں مشکوک سرگرمی۔ چیک کریں: https://verify-secure.in,1,آپ کے netflix اکاؤنٹ میں مشکوک سرگرمی۔ چیک کریں: https:/verify-secure.in,1.0,1.0,0.0,1.0,0.0,0.0,0.0,0.0,0.0
आपका HSBC खाता ब्लॉक कर दिया गया है। यहाँ सत्यापित करें: https://short.url/pay-bill,1,आपका hsbc खाता ब्लॉक कर दिया गया है। यहाँ सत्यापित करें: https:/short.url/pay-bill,1.0,1.0,0.0,1.0,0.0,0.0,1.0,0.0,0.0
உங்கள் Canara Bank கணக்கு முடக்கப்பட்டுள்ளது. சரிபார்க்க: https://short.url/pay-bill,1,உங்கள் canara bank கணக்கு முடக்கப்பட்டுள்ளது. சரிபார்க்க: https:/short.url/pay-bill,1.0,2.0,0.0,0.0,0.0,0.0,0.0,0.0,0.0
Ahmedabadలో వాతావరణం ఎలా ఉంది? 4370,0,ahmedabadలో వాతావరణం ఎలా ఉంది? 4370,0.0,0.0,0.0,0.0,0.0,0.0,0.0,4.0,1.0
ಸಹಾಯಕ್ಕಾಗಿ ಧನ್ಯವಾದಗಳು. 3463,0,ಸಹಾಯಕ್ಕಾಗಿ ಧನ್ಯವಾದಗಳು. 3463,0.0,1.0,0.0,0.0,0.0,0.0,0.0,4.0,0.0
मदद के लिए धन्यवाद। 7663,0,मदद के लिए धन्यवाद। 7663,0.0,0.0,0.0,0.0,0.0,0.0,0.0,4.0,0.0
Jaipur का मौसम कैसा है? 2272,0,jaipur का मौसम कैसा है? 2272,0.0,0.0,0.0,0.0,0.0,0.0,0.0,4.0,1.0
ଅଭିନ୍ଦନ! ଆପଣ 25000 BDT ଜିତିଛନ୍ତି। ଏଠାରେ ପାଆନ୍ତୁ: https://verify-secure.in,1,ଅଭିନ୍ଦନ! ଆପଣ 25000 bdt ଜିତିଛନ୍ତି। ଏଠାରେ ପାଆନ୍ତୁ: https:/verify-secure.in,1.0,1.0,0.0,1.0,0.0,0.0,1.0,5.0,1.0
તમારું બેંક ખાતું બંધ કરવામાં આવશે. તરત જ ક્લિક કરો,1,તમારું બેંક ખાતું બંધ કરવામાં આવશે. તરત જ ક્લિક કરો,0.0,1.0,0.0,0.0,0.0,0.0,0.0,0.0,0.0
તમારું XpressBees પાર્સલ અટકી ગયું છે. ચુકવણી કરો: http://goo.gl/verify-account,1,તમારું xpressbees પાર્સલ અટકી ગયું છે. ચુકવણી કરો: http:/goo.gl/verify-account,1.0,2.0,0.0,1.0,0.0,1.0,0.0,0.0,0.0
ଜନ୍ମଦିନର ଅନେକ ଅନେକ ଶੁଭେଚ୍ଛା! 9893,0,ଜନ୍ମଦିନର ଅନେକ ଅନେକ ଶੁଭେଚ୍ଛା! 9893,0.0,0.0,0.0,0.0,0.0,0.0,0.0,4.0,1.0
ਤੁਹਾਡਾ Ecom Express ਪਾਰਸਲ ਰੁਕਿਆ ਹੋਇਆ ਹੈ। ਫੀਸ ਭਰੋ: http://tinyurl.com/secure-login,1,ਤੁਹਾਡਾ ecom express ਪਾਰਸਲ ਰੁਕਿਆ ਹੋਇਆ ਹੈ। ਫੀਸ ਭਰੋ: http:/tinyurl.com/secure-login,1.0,1.0,0.0,0.0,0.0,1.0,0.0,0.0,0.0
आपका Shiprocket पार्सल रुका हुआ है। शुल्क भरें: https://short.url/pay-bill,1,आपका shiprocket पार्सल रुका हुआ है। शुल्क भरें: https:/short.url/pay-bill,1.0,1.0,0.0,0.0,0.0,0.0,0.0,0.0,0.0
আপনার IndusInd অ্যাকাউন্ট বন্ধ করা হয়েছে। যাচাই করুন: https://verify-secure.in,1,আপনার indusind অ্যাকাউন্ট বন্ধ করা হয়েছে। যাচাই করুন: https:/verify-secure.in,1.0,1.0,0.0,1.0,0.0,0.0,0.0,0.0,0.0
ಹುಟ್ಟುಹಬ್ಬದ ಶುಭಾಶಯಗಳು! 9828,0,ಹುಟ್ಟುಹಬ್ಬದ ಶುಭಾಶಯಗಳು! 9828,0.0,0.0,0.0,0.0,0.0,0.0,0.0,4.0,1.0
അഭിനന്ദനങ്ങൾ! നിങ്ങൾ 25000 Rs നേടിയിരിക്കുന്നു. ക്ലെയിം ചെയ്യാൻ: http://goo.gl/verify-account,1,അഭിനന്ദനങ്ങൾ! നിങ്ങൾ 25000 rs നേടിയിരിക്കുന്നു. ക്ലെയിം ചെയ്യാൻ: http:/goo.gl/verify-account,1.0,2.0,0.0,1.0,0.0,1.0,0.0,5.0,1.0
அவசரம்: உங்கள் KYC-ஐ உடனே புதுப்பிக்கவும்: http://claim-prize.top 5057,1,அவசரம்: உங்கள் kyc-ஐ உடனே புதுப்பிக்கவும்: http:/claim-prize.top 5057,1.0,1.0,0.0,1.0,0.0,0.0,1.0,4.0,0.0
براہ کرم فائل بھیج دیں۔ 9779,0,براہ کرم فائل بھیج دیں۔ 9779,0.0,0.0,0.0,0.0,0.0,0.0,0.0,4.0,0.0
మీ FedEx పార్శిల్ ఆగిపోయింది. చెల్లించండి: http://bit.ly/update-now,1,మీ fedex పార్శిల్ ఆగిపోయింది. చెల్లించండి: http:/bit.ly/update-now,1.0,2.0,0.0,0.0,0.0,1.0,0.0,0.0,0.0
ਤੁਹਾਡਾ Yes Bank ਖਾਤਾ ਬੰਦ ਕਰ ਦਿੱਤਾ ਗਿਆ ਹੈ। ਇੱਥੇ ਦੇਖੋ: https://bank-kyc.net,1,ਤੁਹਾਡਾ yes bank ਖਾਤਾ ਬੰਦ ਕਰ ਦਿੱਤਾ ਗਿਆ ਹੈ। ਇੱਥੇ ਦੇਖੋ: https:/bank-kyc.net,1.0,1.0,0.0,0.0,0.0,0.0,0.0,0.0,0.0
অভিনন্দন! আপুনি 100000 INR জিকিছে। ইয়াত পাওক: https://verify-secure.in,1,অভিনন্দন! আপুনি 100000 inr জিকিছে। ইয়াত পাওক: https:/verify-secure.in,1.0,1.0,0.0,1.0,0.0,0.0,1.0,6.0,1.0
घर पहुँच गया हूँ। 1674,0,घर पहुँच गया हूँ। 1674,0.0,0.0,0.0,0.0,0.0,0.0,0.0,4.0,0.0
سالگرہ مبارک! 9440,0,سالگرہ مبارک! 9440,0.0,0.0,0.0,0.0,0.0,0.0,0.0,4.0,1.0
तातडीचे: तुमचे KYC अपडेट करा: https://bank-kyc.net,1,तातडीचे: तुमचे kyc अपडेट करा: https:/bank-kyc.net,1.0,1.0,0.0,0.0,0.0,0.0,1.0,0.0,0.0
தயவுசெய்து கோப்பை அனுப்பவும். 7553,0,தயவுசெய்து கோப்பை அனுப்பவும். 7553,0.0,1.0,0.0,0.0,0.0,0.0,0.0,4.0,0.0
অনুগ্ৰহ কৰি ফাইলটো পঠাওক। 8989,0,অনুগ্ৰহ কৰি ফাইলটো পঠাওক। 8989,0.0,0.0,0.0,0.0,0.0,0.0,0.0,4.0,0.0
The meeting is rescheduled to Monday. 5619,0,the meeting is rescheduled to monday. 5619,0.0,1.0,0.0,0.0,0.0,0.0,0.0,4.0,0.0
ମୁଁ ଘରେ ପହଞ୍ଚି ଗଲିଣି। 5553,0,ମୁଁ ଘରେ ପହଞ୍ଚି ଗଲିଣି। 5553,0.0,0.0,0.0,0.0,0.0,0.0,0.0,4.0,0.0
URGENT: Your BoB KYC is pending. Update now: http://tinyurl.com/secure-login 4056,1,urgent: your bob kyc is pending. update now: http:/tinyurl.com/secure-login 4056,1.0,2.0,0.0,1.0,0.0,1.0,2.0,4.0,0.0
పుట్టినరోజు శుభాకాంక్షలు! 3909,0,పుట్టినరోజు శుభాకాంక్షలు! 3909,0.0,0.0,0.0,0.0,0.0,0.0,0.0,4.0,1.0
فوری: اپنا KYC اپ ڈیٹ کریں: http://bit.ly/update-now,1,فوری: اپنا kyc اپ ڈیٹ کریں: http:/bit.ly/update-now,1.0,1.0,0.0,0.0,0.0,1.0,1.0,0.0,0.0
ਜਨਮਦਿਨ ਮੁਬਾਰਕ! 9473,0,ਜਨਮਦਿਨ ਮੁਬਾਰਕ! 9473,0.0,0.0,0.0,0.0,0.0,0.0,0.0,4.0,1.0
तुमचे PayPal खाते ब्लॉक केले आहे. येथे क्लिक करा: https://verify-secure.in,1,तुमचे paypal खाते ब्लॉक केले आहे. येथे क्लिक करा: https:/verify-secure.in,1.0,2.0,0.0,1.0,0.0,0.0,0.0,0.0,0.0
پے ٹی ایم: آپ کے والٹ میں 500 روپے بونس۔ کلیم کریں,1,پے ٹی ایم: آپ کے والٹ میں 500 روپے بونس۔ کلیم کریں,0.0,0.0,0.0,0.0,0.0,0.0,0.0,3.0,0.0
సహాయం చేసినందుకు ధನ್ಯవాదాలు. 6480,0,సహాయం చేసినందుకు ధನ್ಯవాదాలు. 6480,0.0,1.0,0.0,0.0,0.0,0.0,0.0,4.0,0.0
నేను ఇంటికి చేరుకున్నాను. 2311,0,నేను ఇంటికి చేరుకున్నాను. 2311,0.0,1.0,0.0,0.0,0.0,0.0,0.0,4.0,0.0
Happy birthday! Have a great one. 4557,0,happy birthday! have a great one. 4557,0.0,1.0,0.0,0.0,0.0,0.0,0.0,4.0,1.0
मी घरी पोहोचलो. 7462,0,मी घरी पोहोचलो. 7462,0.0,1.0,0.0,0.0,0.0,0.0,0.0,4.0,0.0
ನಾವು ಇಂದು ಭೇಟಿಯಾಗೋಣವೇ? 9067,0,ನಾವು ಇಂದು ಭೇಟಿಯಾಗೋಣವೇ? 9067,0.0,0.0,0.0,0.0,0.0,0.0,0.0,4.0,1.0
ସେହି ଫାଇଲଗୁଡିକ ପଠାଇ ପାରିବେ କି?,0,ସେହି ଫାଇଲଗୁଡିକ ପଠାଇ ପାରିବେ କି?,0.0,0.0,0.0,0.0,0.0,0.0,0.0,0.0,1.0
मी घरी पोहोचलो. 2413,0,मी घरी पोहोचलो. 2413,0.0,1.0,0.0,0.0,0.0,0.0,0.0,4.0,0.0
مبارک ہو! آپ نے 100000 ₹ جیتے ہیں۔ کلیم کریں: https://bank-kyc.net,1,مبارک ہو! آپ نے 100000 ₹ جیتے ہیں۔ کلیم کریں: https:/bank-kyc.net,1.0,1.0,0.0,0.0,0.0,0.0,0.0,6.0,1.0
मी घरी पोहोचलो. 7909,0,मी घरी पोहोचलो. 7909,0.0,1.0,0.0,0.0,0.0,0.0,0.0,4.0,0.0
உங்கள் Snapchat கணக்கில் அசாதாரண செயல்பாடு. சரிபார்க்க: http://tinyurl.com/secure-login,1,உங்கள் snapchat கணக்கில் அசாதாரண செயல்பாடு. சரிபார்க்க: http:/tinyurl.com/secure-login,1.0,2.0,0.0,0.0,0.0,1.0,0.0,0.0,0.0
तुमचा XpressBees पार्सल थांबला आहे. शुल्क भरा: http://claim-prize.top,1,तुमचा xpressbees पार्सल थांबला आहे. शुल्क भरा: http:/claim-prize.top,1.0,2.0,0.0,0.0,0.0,0.0,0.0,0.0,0.0
Thanks for the gift! 3437,0,thanks for the gift! 3437,0.0,0.0,0.0,0.0,0.0,0.0,0.0,4.0,1.0
ಅಭಿನಂದನೆಗಳು! ನೀವು 50000 BDT ಗೆದ್ದಿದ್ದೀರಿ. ಪಡೆಯಲು: https://bank-kyc.net,1,ಅಭಿನಂದನೆಗಳು! ನೀವು 50000 bdt ಗೆದ್ದಿದ್ದೀರಿ. ಪಡೆಯಲು: https:/bank-kyc.net,1.0,2.0,0.0,0.0,0.0,0.0,1.0,5.0,1.0
জরুরী: আপনার KYC আপডেট করুন: http://tinyurl.com/secure-login 5744,1,জরুরী: আপনার kyc আপডেট করুন: http:/tinyurl.com/secure-login 5744,1.0,1.0,0.0,0.0,0.0,1.0,1.0,4.0,0.0
আপনার Shiprocket পার্সেল আটকে আছে। টাকা জমা দিন: https://verify-secure.in,1,আপনার shiprocket পার্সেল আটকে আছে। টাকা জমা দিন: https:/verify-secure.in,1.0,1.0,0.0,1.0,0.0,0.0,0.0,0.0,0.0
ਤੁਹਾਡਾ XpressBees ਪਾਰਸਲ ਰੁਕਿਆ ਹੋਇਆ ਹੈ। ਫੀਸ ਭਰੋ: http://bit.ly/update-now,1,ਤੁਹਾਡਾ xpressbees ਪਾਰਸਲ ਰੁਕਿਆ ਹੋਇਆ ਹੈ। ਫੀਸ ਭਰੋ: http:/bit.ly/update-now,1.0,1.0,0.0,0.0,0.0,1.0,0.0,0.0,0.0
આજે સાંજે ક્યાં મળવાનું?,0,આજે સાંજે ક્યાં મળવાનું?,0.0,0.0,0.0,0.0,0.0,0.0,0.0,0.0,1.0
तुमचे BoB खाते ब्लॉक केले आहे. येथे क्लिक करा: http://claim-prize.top,1,तुमचे bob खाते ब्लॉक केले आहे. येथे क्लिक करा: http:/claim-prize.top,1.0,2.0,0.0,0.0,0.0,0.0,0.0,0.0,0.0
ਤੁਹਾਡੇ Swiggy ਖਾਤੇ ਵਿੱਚ ਸ਼ੱਕੀ ਗਤੀਵਿਧੀ। ਚੈੱਕ ਕਰੋ: https://short.url/pay-bill,1,ਤੁਹਾਡੇ swiggy ਖਾਤੇ ਵਿੱਚ ਸ਼ੱਕੀ ਗਤੀਵਿਧੀ। ਚੈੱਕ ਕਰੋ: https:/short.url/pay-bill,1.0,1.0,0.0,0.0,0.0,0.0,0.0,0.0,0.0
Kolkata-ত বৰষুণ দিছে নেকি?,0,kolkata-ত বৰষুণ দিছে নেকি?,0.0,0.0,0.0,0.0,0.0,0.0,0.0,0.0,1.0
জৰুৰী: আপোনাৰ KYC আপডেট কৰক: https://verify-secure.in 5842,1,জৰুৰী: আপোনাৰ kyc আপডেট কৰক: https:/verify-secure.in 5842,1.0,1.0,0.0,1.0,0.0,0.0,1.0,4.0,0.0
Your package is pending. Update payment details,1,your package is pending. update payment details,0.0,1.0,0.0,0.0,0.0,0.0,0.0,0.0,0.0
దయచేసి ఫైల్ పంపండి. 9288,0,దయచేసి ఫైల్ పంపండి. 9288,0.0,1.0,0.0,0.0,0.0,0.0,0.0,4.0,0.0
আজ কি দেখা হবে? 2331,0,আজ কি দেখা হবে? 2331,0.0,0.0,0.0,0.0,0.0,0.0,0.0,4.0,1.0
আপনার Netflix অ্যাকাউন্টে সন্দেহজনক লগইন। দেখুন: http://goo.gl/verify-account,1,আপনার netflix অ্যাকাউন্টে সন্দেহজনক লগইন। দেখুন: http:/goo.gl/verify-account,1.0,1.0,0.0,1.0,0.0,1.0,0.0,0.0,0.0
پارسل ڈیلیور ہو گیا,0,پارسل ڈیلیور ہو گیا,0.0,0.0,0.0,0.0,0.0,0.0,0.0,0.0,0.0
ದಯವಿಟ್ಟು ಫೈಲ್ ಕಳುಹಿಸಿ.,0,ದಯವಿಟ್ಟು ಫೈಲ್ ಕಳುಹಿಸಿ.,0.0,1.0,0.0,0.0,0.0,0.0,0.0,0.0,0.0
آپ کا PayPal اکاؤنٹ معطل کر دیا گیا ہے۔ تصدیق کریں: https://verify-secure.in,1,آپ کا paypal اکاؤنٹ معطل کر دیا گیا ہے۔ تصدیق کریں: https:/verify-secure.in,1.0,1.0,0.0,1.0,0.0,0.0,0.0,0.0,0.0
میں گھر پہنچ گیا ہوں۔ 3805,0,میں گھر پہنچ گیا ہوں۔ 3805,0.0,0.0,0.0,0.0,0.0,0.0,0.0,4.0,0.0
നിങ്ങളുടെ Prime Video അക്കൗണ്ടിൽ സംശയാസ്പദമായ നീക്കം. പരിശോധിക്കുക: http://bit.ly/update-now,1,നിങ്ങളുടെ prime video അക്കൗണ്ടിൽ സംശയാസ്പദമായ നീക്കം. പരിശോധിക്കുക: http:/bit.ly/update-now,1.0,2.0,0.0,0.0,0.0,1.0,0.0,0.0,0.0
സഹായത്തിന് നന്ദی. 1619,0,സഹായത്തിന് നന്ദی. 1619,0.0,1.0,0.0,0.0,0.0,0.0,0.0,4.0,0.0
آپ کے Uber اکاؤنٹ میں مشکوک سرگرمی۔ چیک کریں: https://bank-kyc.net,1,آپ کے uber اکاؤنٹ میں مشکوک سرگرمی۔ چیک کریں: https:/bank-kyc.net,1.0,1.0,0.0,0.0,0.0,0.0,0.0,0.0,0.0
வாழ்த்துக்கள்! நீங்கள் 100000 INR வென்றுள்ளீர்கள். பெற: http://goo.gl/verify-account 7811,1,வாழ்த்துக்கள்! நீங்கள் 100000 inr வென்றுள்ளீர்கள். பெற: http:/goo.gl/verify-account 7811,1.0,2.0,0.0,1.0,0.0,1.0,1.0,10.0,1.0
आपका PayPal खाता ब्लॉक कर दिया गया है। यहाँ सत्यापित करें: http://tinyurl.com/secure-login,1,आपका paypal खाता ब्लॉक कर दिया गया है। यहाँ सत्यापित करें: http:/tinyurl.com/secure-login,1.0,1.0,0.0,1.0,0.0,1.0,0.0,0.0,0.0
শুভ জন্মদিন! 2879,0,শুভ জন্মদিন! 2879,0.0,0.0,0.0,0.0,0.0,0.0,0.0,4.0,1.0
നിങ്ങളുടെ Netflix അക്കൗണ്ടിൽ സംശയാസ്പദമായ നീക്കം. പരിശോധിക്കുക: https://short.url/pay-bill 8904,1,നിങ്ങളുടെ netflix അക്കൗണ്ടിൽ സംശയാസ്പദമായ നീക്കം. പരിശോധിക്കുക: https:/short.url/pay-bill 8904,1.0,2.0,0.0,0.0,0.0,0.0,0.0,4.0,0.0
તમારું Ecom Express પાર્સલ અટકી ગયું છે. ચુકવણી કરો: https://short.url/pay-bill,1,તમારું ecom express પાર્સલ અટકી ગયું છે. ચુકવણી કરો: https:/short.url/pay-bill,1.0,2.0,0.0,0.0,0.0,0.0,0.0,0.0,0.0
സഹായത്തിന് നന്ദی.,0,സഹായത്തിന് നന്ദی.,0.0,1.0,0.0,0.0,0.0,0.0,0.0,0.0,0.0
வாழ்த்துக்கள்! நீங்கள் 75000 INR வென்றுள்ளீர்கள். பெற: https://bank-kyc.net,1,வாழ்த்துக்கள்! நீங்கள் 75000 inr வென்றுள்ளீர்கள். பெற: https:/bank-kyc.net,1.0,2.0,0.0,0.0,0.0,0.0,1.0,5.0,1.0
ನಿಮ್ಮ Amazon ಖಾತೆಯಲ್ಲಿ ಅಸಹಜ ಚಟುವಟಿಕೆ. ಪರಿಶೀಲಿಸಿ: https://short.url/pay-bill,1,ನಿಮ್ಮ amazon ಖಾತೆಯಲ್ಲಿ ಅಸಹಜ ಚಟುವಟಿಕೆ. ಪರಿಶೀಲಿಸಿ: https:/short.url/pay-bill,1.0,2.0,0.0,0.0,0.0,0.0,0.0,0.0,0.0
आयसीआयसीआय: कार्ड ब्लॉक होईल। री-अॅक्टिव्हेट करा,1,आयसीआयसीआय: कार्ड ब्लॉक होईल। री-अॅक्टिव्हेट करा,0.0,0.0,0.0,0.0,0.0,0.0,0.0,0.0,0.0
ଜରୁରୀ: ଆପଣଙ୍କ KYC ଅପଡੇଟ୍ କରନ୍ତୁ: https://verify-secure.in 2780,1,ଜରୁରୀ: ଆପଣଙ୍କ kyc ଅପଡੇଟ୍ କରନ୍ତୁ: https:/verify-secure.in 2780,1.0,1.0,0.0,1.0,0.0,0.0,1.0,4.0,0.0
Pune ਕਿਵੇਂ ਹੈ?,0,pune ਕਿਵੇਂ ਹੈ?,0.0,0.0,0.0,0.0,0.0,0.0,0.0,0.0,1.0
మనం సాయంత్రం కలుద్దామా? 3774,0,మనం సాయంత్రం కలుద్దామా? 3774,0.0,0.0,0.0,0.0,0.0,0.0,0.0,4.0,1.0
Unusual login in your Spotify account. Check: https://verify-secure.in,1,unusual login in your spotify account. check: https:/verify-secure.in,1.0,2.0,0.0,1.0,0.0,0.0,0.0,0.0,0.0
Kolkata ଯାତ୍ରା କେମିତି ଥିଲା? 6866,0,kolkata ଯାତ୍ରା କେମିତି ଥିଲା? 6866,0.0,0.0,0.0,0.0,0.0,0.0,0.0,4.0,1.0
നിങ്ങളുടെ PayPal അക്കൗണ്ട് മരവിപ്പിച്ചു. പരിശോധിക്കാൻ: https://bank-kyc.net,1,നിങ്ങളുടെ paypal അക്കൗണ്ട് മരവിപ്പിച്ചു. പരിശോധിക്കാൻ: https:/bank-kyc.net,1.0,2.0,0.0,0.0,0.0,0.0,0.0,0.0,0.0
ਵਧਾਈ ਹੋਵੇ! ਤੁਸੀਂ 100000 Rs ਜਿੱਤੇ ਹਨ। ਇੱਥੇ ਪ੍ਰਾਪਤ ਕਰੋ: https://short.url/pay-bill,1,ਵਧਾਈ ਹੋਵੇ! ਤੁਸੀਂ 100000 rs ਜਿੱਤੇ ਹਨ। ਇੱਥੇ ਪ੍ਰਾਪਤ ਕਰੋ: https:/short.url/pay-bill,1.0,1.0,0.0,0.0,0.0,0.0,0.0,6.0,1.0
Delhi-ত বৰষুণ দিছে নেকি? 7284,0,delhi-ত বৰষুণ দিছে নেকি? 7284,0.0,0.0,0.0,0.0,0.0,0.0,0.0,4.0,1.0
जन्मदिन की बहुत-बहुत बधाई! 1192,0,जन्मदिन की बहुत-बहुत बधाई! 1192,0.0,0.0,0.0,0.0,0.0,0.0,0.0,4.0,1.0
আজ কি দেখা হবে? 1413,0,আজ কি দেখা হবে? 1413,0.0,0.0,0.0,0.0,0.0,0.0,0.0,4.0,1.0
मदद के लिए धन्यवाद। 4534,0,मदद के लिए धन्यवाद। 4534,0.0,0.0,0.0,0.0,0.0,0.0,0.0,4.0,0.0
ଅଭିନ୍ଦନ! ଆପଣ 75000 BDT ଜିତିଛନ୍ତି। ଏଠାରେ ପାଆନ୍ତୁ: http://bit.ly/update-now,1,ଅଭିନ୍ଦନ! ଆପଣ 75000 bdt ଜିତିଛନ୍ତି। ଏଠାରେ ପାଆନ୍ତୁ: http:/bit.ly/update-now,1.0,1.0,0.0,0.0,0.0,1.0,1.0,5.0,1.0
உதவிக்கு நன்றி. 1524,0,உதவிக்கு நன்றி. 1524,0.0,1.0,0.0,0.0,0.0,0.0,0.0,4.0,0.0
Gym membership expires next week,0,gym membership expires next week,0.0,0.0,0.0,0.0,0.0,0.0,0.0,0.0,0.0
बधाई हो! आपने 10000 Rs जीते हैं। दावा करें: http://goo.gl/verify-account,1,बधाई हो! आपने 10000 rs जीते हैं। दावा करें: http:/goo.gl/verify-account,1.0,1.0,0.0,1.0,0.0,1.0,0.0,5.0,1.0
இன்று நாம் சந்திக்கலாமா? 7120,0,இன்று நாம் சந்திக்கலாமா? 7120,0.0,0.0,0.0,0.0,0.0,0.0,0.0,4.0,1.0
మీ Swiggy ఖాతాలో అసాధారణ కార్యాచరణ. తనిఖీ చేయండి: http://bit.ly/update-now,1,మీ swiggy ఖాతాలో అసాధారణ కార్యాచరణ. తనిఖీ చేయండి: http:/bit.ly/update-now,1.0,2.0,0.0,0.0,0.0,1.0,0.0,0.0,0.0
Ahmedabad-ত বৰষুণ দিছে নেকি? 7271,0,ahmedabad-ত বৰষুণ দিছে নেকি? 7271,0.0,0.0,0.0,0.0,0.0,0.0,0.0,4.0,1.0
तुमचा आधार-पॅन लिंक नाही। तात्काळ लिंक करा,1,तुमचा आधार-पॅन लिंक नाही। तात्काळ लिंक करा,0.0,0.0,0.0,0.0,0.0,0.0,0.0,0.0,0.0
మీ HDFC ఖాతా నిలిపివేయబడింది. ధృవీకరించండి: http://bit.ly/update-now,1,మీ hdfc ఖాతా నిలిపివేయబడింది. ధృవీకరించండి: http:/bit.ly/update-now,1.0,2.0,0.0,1.0,0.0,1.0,1.0,0.0,0.0
Thanks for the gift! 1834,0,thanks for the gift! 1834,0.0,0.0,0.0,0.0,0.0,0.0,0.0,4.0,1.0
জরুরী: আপনার KYC আপডেট করুন: https://verify-secure.in 7575,1,জরুরী: আপনার kyc আপডেট করুন: https:/verify-secure.in 7575,1.0,1.0,0.0,1.0,0.0,0.0,1.0,4.0,0.0
অনুগ্ৰহ কৰি ফাইলটো পঠাওক। 7831,0,অনুগ্ৰহ কৰি ফাইলটো পঠাওক। 7831,0.0,0.0,0.0,0.0,0.0,0.0,0.0,4.0,0.0
Mumbai பயணம் எப்படி இருந்தது?,0,mumbai பயணம் எப்படி இருந்தது?,0.0,0.0,0.0,0.0,0.0,0.0,0.0,0.0,1.0
तुमचा Amazon पार्सल थांबला आहे. शुल्क भरा: https://bank-kyc.net,1,तुमचा amazon पार्सल थांबला आहे. शुल्क भरा: https:/bank-kyc.net,1.0,2.0,0.0,0.0,0.0,0.0,0.0,0.0,0.0
సహాయం చేసినందుకు ధನ್ಯవాదాలు. 8081,0,సహాయం చేసినందుకు ధನ್ಯవాదాలు. 8081,0.0,1.0,0.0,0.0,0.0,0.0,0.0,4.0,0.0
বাড়ি পৌঁছে গেছি। 5851,0,বাড়ি পৌঁছে গেছি। 5851,0.0,0.0,0.0,0.0,0.0,0.0,0.0,4.0,0.0
ଆପଣଙ୍କ Jio ଆକାଉଣ୍ଟରେ ଅସ୍ୱାଭାବିକ କାର୍ଯ୍ୟକଳାପ। ଦେଖନ୍ତୁ: http://goo.gl/verify-account 1867,1,ଆପଣଙ୍କ jio ଆକାଉଣ୍ଟରେ ଅସ୍ୱାଭାବିକ କାର୍ଯ୍ୟକଳାପ। ଦେଖନ୍ତୁ: http:/goo.gl/verify-account 1867,1.0,1.0,0.0,1.0,0.0,1.0,0.0,4.0,0.0
ನಿಮ್ಮ Airtel ಖಾತೆಯಲ್ಲಿ ಅಸಹಜ ಚಟುವಟಿಕೆ. ಪರಿಶೀಲಿಸಿ: https://short.url/pay-bill,1,ನಿಮ್ಮ airtel ಖಾತೆಯಲ್ಲಿ ಅಸಹಜ ಚಟುವಟಿಕೆ. ಪರಿಶೀಲಿಸಿ: https:/short.url/pay-bill,1.0,2.0,0.0,0.0,0.0,0.0,0.0,0.0,0.0
ഞാൻ വീട്ടിലെത്തി. 7287,0,ഞാൻ വീട്ടിലെത്തി. 7287,0.0,1.0,0.0,0.0,0.0,0.0,0.0,4.0,0.0
ദയവായി ഫയൽ അയക്കൂ. 1474,0,ദയവായി ഫയൽ അയക്കൂ. 1474,0.0,1.0,0.0,0.0,0.0,0.0,0.0,4.0,0.0
আইচিআইচিআই: কাৰ্ড ব্লক হ'ব। পুনৰ সক্ৰিয় কৰক,1,আইচিআইচিআই: কাৰ্ড ব্লক হ'ব। পুনৰ সক্ৰিয় কৰক,0.0,0.0,0.0,0.0,0.0,0.0,0.0,0.0,0.0
জৰুৰী: আপোনাৰ KYC আপডেট কৰক: http://bit.ly/update-now,1,জৰুৰী: আপোনাৰ kyc আপডেট কৰক: http:/bit.ly/update-now,1.0,1.0,0.0,0.0,0.0,1.0,1.0,0.0,0.0
Package from Delhivery is delayed. Pay fee: https://bank-kyc.net,1,package from delhivery is delayed. pay fee: https:/bank-kyc.net,1.0,2.0,0.0,0.0,0.0,0.0,0.0,0.0,0.0
জন্মদিনৰ শুভকামনা জনালোঁ! 5868,0,জন্মদিনৰ শুভকামনা জনালোঁ! 5868,0.0,0.0,0.0,0.0,0.0,0.0,0.0,4.0,1.0
ਜਰੂਰੀ: ਆਪਣਾ KYC ਅਪਡੇਟ ਕਰੋ: https://short.url/pay-bill 2169,1,ਜਰੂਰੀ: ਆਪਣਾ kyc ਅਪਡੇਟ ਕਰੋ: https:/short.url/pay-bill 2169,1.0,1.0,0.0,0.0,0.0,0.0,1.0,4.0,0.0
Kolkata کا سفر کیسا رہا؟ 2968,0,kolkata کا سفر کیسا رہا؟ 2968,0.0,0.0,0.0,0.0,0.0,0.0,0.0,4.0,0.0
जन्मदिन की बहुत-बहुत बधाई! 3707,0,जन्मदिन की बहुत-बहुत बधाई! 3707,0.0,0.0,0.0,0.0,0.0,0.0,0.0,4.0,1.0
